paper_id,title,cluster,citations,year,pca_x,pca_y
1,HiStream: Efficient High-Resolution Video Generation via Redundancy-Eliminated Streaming,16,10,2025,0.03542420792939095,0.35052951288823747
2,Beyond Memorization: A Multi-Modal Ordinal Regression Benchmark to Expose Popularity Bias in Vision-Language Models,12,10,2025,0.23253277846497086,0.06751699691144772
3,Optimizing Decoding Paths in Masked Diffusion Models by Quantifying Uncertainty,11,10,2025,0.12808556229783538,0.216303018427434
4,Autonomous Uncertainty Quantification for Computational Point-of-care Sensors,10,10,2025,-0.25390822397786617,-0.12493797958877882
5,Streaming Video Instruction Tuning,16,10,2025,0.09863984763074302,0.2606929801947794
6,Fast SAM2 with Text-Driven Token Pruning,16,10,2025,0.02993482130652749,0.3052358078849586
7,C2LLM Technical Report: A New Frontier in Code Retrieval via Adaptive Cross-Attention Pooling,17,10,2025,0.19914400430439005,-0.004557748675157441
8,TICON: A Slide-Level Tile Contextualizer for Histopathology Representation Learning,2,10,2025,0.03873474471463353,0.04147699729527842
9,Your Reasoning Benchmark May Not Test Reasoning: Revealing Perception Bottleneck in Abstract Reasoning Benchmarks,15,10,2025,0.3975997162192712,-0.10058926670507345
10,Measuring all the noises of LLM Evals,5,10,2025,0.021747447162569232,-0.13985570836438904
11,Towards Practical Automatic Piano Reduction using BERT with Semi-supervised Learning,3,10,2025,-0.23237913583912576,-0.18426180580061827
12,Parallel Token Prediction for Language Models,2,10,2025,0.10177871261001384,0.09566941521418552
13,An Allele-Centric Pan-Graph-Matrix Representation for Scalable Pangenome Analysis,8,10,2025,-0.12769274049953339,-0.027758406017685967
14,Variationally correct operator learning: Reduced basis neural operator with a posteriori error estimation,10,10,2025,-0.2658891464705616,-0.06419927100242681
15,"Scaling Laws for Economic Productivity: Experimental Evidence in LLM-Assisted Consulting, Data Analyst, and Management Tasks",5,10,2025,0.20904982648784254,-0.2344630580060954
16,Does the Data Processing Inequality Reflect Practice? On the Utility of Low-Level Tasks,3,10,2025,-0.13103636186726772,-0.05545984398820081
17,Learning to Solve PDEs on Neural Shape Representations,10,10,2025,-0.161419967615427,-0.004934786540834611
18,A Plan Reuse Mechanism for LLM-Driven Agent,5,10,2025,0.2182823019824291,-0.24290897416643242
19,A Note on Publicly Verifiable Quantum Money with Low Quantum Computational Resources,7,10,2025,-0.1499270211728054,-0.09419922983790745
20,AndroidLens: Long-latency Evaluation with Nested Sub-targets for Android GUI Agents,0,10,2025,0.11686554637383523,-0.018636848102587644
21,Transcriptome-Conditioned Personalized De Novo Drug Generation for AML Using Metaheuristic Assembly and Target-Driven Filtering,14,10,2025,-0.09648593388702917,0.024330454817889736
22,Quadrupped-Legged Robot Movement Plan Generation using Large Language Model,5,10,2025,0.1978244303077897,-0.09066188171693247
23,Model Merging via Multi-Teacher Knowledge Distillation,3,10,2025,0.0684324199592516,0.05785823037936755
24,Post-Processing Mask-Based Table Segmentation for Structural Coordinate Extraction,9,10,2025,-0.12947720978019717,0.11333922683395826
25,Surgical Scene Segmentation using a Spike-Driven Video Transformer with Real-Time Potential,16,10,2025,-0.0721587360330768,0.062181291907384605
26,"SMART SLM: Structured Memory and Reasoning Transformer, A Small Language Model for Accurate Document Assistance",2,10,2025,0.05930950157198365,-0.08963484237967559
27,GriDiT: Factorized Grid-Based Diffusion for Efficient Long Image Sequence Generation,11,10,2025,-0.00038848318917584666,0.37866475149337264
28,ACD: Direct Conditional Control for Video Diffusion Models via Attention Supervision,16,10,2025,-0.02929832704809622,0.3877298640889769
29,AnyAD: Unified Any-Modality Anomaly Detection in Incomplete Multi-Sequence MRI,9,10,2025,-0.0198928647328043,0.14117846391765038
30,ReaSeq: Unleashing World Knowledge via Reasoning for Sequential Modeling,15,10,2025,0.34440173876581587,-0.12052062164926326
31,DreaMontage: Arbitrary Frame-Guided One-Shot Video Generation,16,10,2025,0.07575405092146294,0.3146359578489283
32,Uncertainty in security: managing cyber senescence,14,10,2025,-0.06507372734653619,-0.035948299299446665
33,CoTDeceptor:Adversarial Code Obfuscation Against CoT-Enhanced LLM Code Agents,17,10,2025,0.2437992476666461,-0.15574202128887502
34,Industrial Ouroboros: Deep Lateral Movement via Living Off the Plant,10,10,2025,-0.1937222658070752,-0.10222942720646945
35,Learning Factors in AI-Augmented Education: A Comparative Study of Middle and High School Students,18,10,2025,-0.07095401168604118,-0.20423306833687205
36,LookPlanGraph: Embodied Instruction Following Method with VLM Graph Augmentation,8,10,2025,0.011742897784010583,-0.02134397761323258
37,Improving the Convergence Rate of Ray Search Optimization for Query-Efficient Hard-Label Attacks,14,11,2025,-0.18630722495665666,0.011833706284530902
38,Assessing the Software Security Comprehension of Large Language Models,17,12,2025,0.4049791444363141,-0.20514377509965462
39,SegMo: Segment-aligned Text to 3D Human Motion Generation,4,13,2025,0.027949378416451866,0.24624307740300777
40,Casting a SPELL: Sentence Pairing Exploration for LLM Limitation-breaking,17,14,2025,0.30304338707929906,-0.0802130880426451
41,RoboCade: Gamifying Robot Data Collection,3,15,2025,-0.07645106043087245,0.0002688187085150913
42,UniTacHand: Unified Spatio-Tactile Representation for Human to Robotic Hand Skill Transfer,3,16,2025,-0.0755129688424724,-0.032883189063890816
43,MiST: Understanding the Role of Mid-Stage Scientific Training in Developing Chemical Reasoning Models,15,17,2025,0.34153762195598547,-0.11265432461999966
44,PhononBench:A Large-Scale Phonon-Based Benchmark for Dynamical Stability in Crystal Generation,17,18,2025,0.15098711504851786,0.048392522862824736
45,Relative Localization System Design for SnailBot: A Modular Self-reconfigurable Robot,14,19,2025,-0.07515468490944828,-0.037473106823050266
46,Leveraging Lightweight Entity Extraction for Scalable Event-Based Image Retrieval,13,20,2025,0.12396911936421748,0.18292844687164442
47,RoboSafe: Safeguarding Embodied Agents via Executable Safety Logic,0,21,2025,0.21805237882252432,-0.10963935610420168
48,Wireless Center of Pressure Feedback System for Humanoid Robot Balance Control using ESP32-C3,14,22,2025,-0.1290107495200234,-0.015613154909806755
49,Latent Implicit Visual Reasoning,12,23,2025,0.32457387784660374,0.22850426567793242
50,Microtopia: Exploring the Impact of Interdisciplinary Projects on Ethnic Minority Female Pupils' Perceptions of Computer Science,18,24,2025,-0.20360137459021657,-0.18059058630727975
51,Causal-driven attribution (CDA): Estimating channel influence without user-level data,8,10,2025,-0.09672263578080408,-0.04150480221450694
52,Human Motion Estimation with Everyday Wearables,4,10,2025,-0.01256701965730665,0.16826693600240317
53,Analytic and Variational Stability of Deep Learning Systems,10,10,2025,-0.285558452207085,-0.14180308556383664
54,SpidR-Adapt: A Universal Speech Representation Model for Few-Shot Adaptation,3,10,2025,0.017654395478885736,-0.012321801712478436
55,Cruising the Spectrum: Joint Spectrum Mobility and Antenna Array Management for Mobile (cm/mm)Wave Connectivity,1,10,2025,-0.11436859035513668,-0.08860748133507387
56,Schrödinger's Navigator: Imagining an Ensemble of Futures for Zero-Shot Object Navigation,6,10,2025,-0.03413628724047485,0.2112895656551451
57,Flocking phase transition and threat responses in bio-inspired autonomous drone swarms,4,10,2025,-0.07565662870318215,0.10250619025469163
58,An O($nlogn$) approximate knapsack algorithm,14,10,2025,-0.1490222858110996,-0.08993876202416763
59,VisRes Bench: On Evaluating the Visual Reasoning Capabilities of VLMs,12,10,2025,0.3794958113107711,0.15012359339104434
60,Adjusted Kolmogorov Complexity of Binary Words with Empirical Entropy Normalization,14,10,2025,-0.09873984935469722,-0.055452892344897746
61,UltraShape 1.0: High-Fidelity 3D Shape Generation via Scalable Geometric Refinement,6,10,2025,0.003225715709550951,0.36894902857973877
62,Towards Arbitrary Motion Completing via Hierarchical Continuous Representation,4,10,2025,-0.11983631607205307,0.15447222894169052
63,Equivariant Multiscale Learned Invertible Reconstruction for Cone Beam CT: From Simulated to Real Data,3,10,2025,-0.18764954015448876,-0.00032847212050803493
64,A Turn Toward Better Alignment: Few-Shot Generative Adaptation with Equivariant Feature Rotation,2,10,2025,0.013337383712240436,0.08889378158310646
65,A Unified Framework for EEG Seizure Detection Using Universum-Integrated Generalized Eigenvalues Proximal Support Vector Machine,9,10,2025,-0.1360819941115922,-0.04309580296084421
66,A Community-Enhanced Graph Representation Model for Link Prediction,8,10,2025,-0.1702140734051389,-0.0304910018273072
67,BALLAST: Bandit-Assisted Learning for Latency-Aware Stable Timeouts in Raft,14,10,2025,-0.15375073826499966,-0.051608991464638904
68,ElfCore: A 28nm Neural Processor Enabling Dynamic Structured Sparse Training and Online Self-Supervised Learning with Activity-Dependent Weight Update,10,10,2025,-0.209654801583371,-0.0710231721890526
69,MODE: Multi-Objective Adaptive Coreset Selection,3,10,2025,-0.12465567936386954,-0.011672247463946584
70,ORCA: Object Recognition and Comprehension for Archiving Marine Species,12,10,2025,0.12329307211498361,0.2082551472420052
71,Encrypted Traffic Detection in Resource Constrained IoT Networks: A Diffusion Model and LLM Integrated Framework,11,10,2025,-0.01418998504763139,0.020558016756690937
72,Emotion Diffusion in Real and Simulated Social Graphs: Structural Limits of LLM-Based Social Simulation,5,10,2025,0.052561661015993244,-0.06570999149544686
73,Declarative distributed broadcast using three-valued modal logic and semitopologies,17,10,2025,0.11718750549428064,-0.11030696447292342
74,TGC-Net: A Structure-Aware and Semantically-Aligned Framework for Text-Guided Medical Image Segmentation,13,10,2025,0.11594423397081755,0.2508298596217503
75,SparScene: Efficient Traffic Scene Representation via Sparse Graph Learning for Large-Scale Trajectory Generation,8,10,2025,-0.05304503897717371,-0.0728545926806412
76,AutoBaxBuilder: Bootstrapping Code Security Benchmarking,17,10,2025,0.2913840057438078,-0.10546573077714745
77,Approximation Schemes for Planar Graph Connectivity Problems,8,10,2025,-0.18133712511963498,-0.0688300452715619
78,A Real-World Evaluation of LLM Medication Safety Reviews in NHS Primary Care,5,10,2025,0.2158133382197161,-0.22768723114434
79,MarineEval: Assessing the Marine Intelligence of Vision-Language Models,12,10,2025,0.23523212925870787,0.0802336898197579
80,ClarifyMT-Bench: Benchmarking and Improving Multi-Turn Clarification for Conversational Large Language Models,5,10,2025,0.38585998564739027,-0.18059563131979456
81,STLDM: Spatio-Temporal Latent Diffusion Model for Precipitation Nowcasting,11,10,2025,-0.04640117953332688,0.11689907249715488
82,Synecdoche: Efficient and Accurate In-Network Traffic Classification via Direct Packet Sequential Pattern Matching,2,10,2025,-0.20380298478982564,-0.04078122024713719
83,A Mechanistic Analysis of Transformers for Dynamical Systems,2,10,2025,-0.04883830671263496,0.009054754342305097
84,Coding-Logic Correspondence: Turning Information and Communication Networks into Logical Formulae via Hypergraph Heyting Algebra,10,10,2025,-0.21207529439542694,-0.11580164854108509
85,Beyond Context: Large Language Models Failure to Grasp Users Intent,17,10,2025,0.2736802091102553,-0.14840077389114048
86,Robust and Efficient MuJoCo-based Model Predictive Control via Web of Affine Spaces Derivatives,14,10,2025,-0.056965710906446344,-0.07147304004751742
87,Semi-Supervised Learning for Large Language Models Safety and Content Moderation,17,11,2025,0.1809207102934834,-0.16263504461382933
88,Semantic Refinement with LLMs for Graph Representations,8,12,2025,-0.044870234462005124,-0.052343891015179486
89,Volatile Organic Compounds for Stress Detection: A Scoping Review and Exploratory Feasibility Study with Low-Cost Sensors,14,13,2025,-0.07495081627567117,-0.05075969217595156
90,FreeInpaint: Tuning-free Prompt Alignment and Visual Rationality Enhancement in Image Inpainting,11,14,2025,0.0714864375342502,0.39950045087997865
91,Shared Representation Learning for High-Dimensional Multi-Task Forecasting under Resource Contention in Cloud-Native Backends,2,15,2025,-0.08185469993534862,0.010294349484837324
92,TexAvatars : Hybrid Texel-3D Representations for Stable Rigging of Photorealistic Gaussian Head Avatars,6,16,2025,-0.16286426164855225,0.20923572369272544
93,UniRec-0.1B: Unified Text and Formula Recognition with 0.1B Parameters,13,17,2025,0.11435178515443989,0.14917908617427758
94,T2AV-Compass: Towards Unified Evaluation for Text-to-Audio-Video Generation,16,18,2025,0.18414290094629973,0.2874105286139403
95,Global End-Effector Pose Control of an Underactuated Aerial Manipulator via Reinforcement Learning,1,19,2025,-0.11201845600845463,-0.1303722760394912
96,Verification of E-Voting Algorithms in Dafny,14,20,2025,-0.012986907357780013,-0.09699698751605924
97,Hierarchical Modeling Approach to Fast and Accurate Table Recognition,2,21,2025,-0.056275867809969064,-0.018275758864093997
98,Dyna-Style Reinforcement Learning Modeling and Control of Non-linear Dynamics,1,22,2025,-0.21182070855975635,-0.17546452422387124
99,LLM Personas as a Substitute for Field Experiments in Method Benchmarking,14,23,2025,-0.03671023962226738,-0.07597779583100848
100,UniPR-3D: Towards Universal Visual Place Recognition with Visual Geometry Grounded Transformer,6,24,2025,0.05823922784677751,0.33787724136590963
101,Blurb-Refined Inference from Crowdsourced Book Reviews using Hierarchical Genre Mining with Dual-Path Graph Convolutions,8,10,2025,-0.029009952768535432,0.006556413776443112
102,Understanding Scaling Laws in Deep Neural Networks via Feature Learning Dynamics,10,10,2025,-0.2027381182329212,-0.07273237723724132
103,Agentic Explainable Artificial Intelligence (Agentic XAI) Approach To Explore Better Explanation,18,10,2025,0.19031363803875812,-0.21694359285630518
104,Language-Guided Grasp Detection with Coarse-to-Fine Learning for Robotic Manipulation,12,10,2025,0.21675112207300784,0.1440495395560475
105,Multimodal Skeleton-Based Action Representation Learning via Decomposition and Composition,13,10,2025,-0.06005460103021891,0.06642205603941365
106,Beyond Pixel Simulation: Pathology Image Generation via Diagnostic Semantic Tokens and Prototype Control,13,10,2025,0.12419919814753519,0.30743087522217644
107,Making AI Work: An Autoethnography of a Workaround in Higher Education,18,10,2025,0.07093378152751802,-0.2240234669743168
108,DexAvatar: 3D Sign Language Reconstruction with Hand and Body Pose Priors,6,10,2025,0.11790059374458349,0.32119250167566926
109,Optical Flow-Guided 6DoF Object Pose Tracking with an Event Camera,4,10,2025,-0.09106870070102803,0.22413604980103013
110,Matrix Completion Via Reweighted Logarithmic Norm Minimization,14,10,2025,-0.14026362604155915,0.10527901523253805
111,zkFL-Health: Blockchain-Enabled Zero-Knowledge Federated Learning for Medical AI Privacy,18,10,2025,0.014244407963654794,-0.14792491161083582
112,Device-Independent Anonymous Communication in Quantum Networks,7,10,2025,-0.20251838189563165,-0.11879732420080642
113,Tracing Energy Flow: Learning Tactile-based Grasping Force Control to Prevent Slippage in Dynamic Object Interaction,4,10,2025,-0.08680725945820389,0.10898015107083578
114,When LLMs fall short in Deductive Coding: Model Comparison and Human AI Collaboration Workflow Design,18,10,2025,0.22891300583478963,-0.22551263541834243
115,A Large-Depth-Range Layer-Based Hologram Dataset for Machine Learning-Based 3D Computer-Generated Holography,6,10,2025,-0.029954752336944147,0.15731946901762342
116,Agentic Multi-Persona Framework for Evidence-Aware Fake News Detection,9,10,2025,0.20660632268494292,0.03352778792803411
117,Next-Scale Prediction: A Self-Supervised Approach for Real-World Image Denoising,2,10,2025,1.7310234426228045e-05,0.20508912389556247
118,A Design Study Process Model for Medical Visualization,14,10,2025,-0.029854185327775465,-0.01592797160820578
119,Quantum Homotopy Algorithm for Solving Nonlinear PDEs and Flow Problems,7,10,2025,-0.1994222591088117,-0.1254521219353864
120,Multi-Attribute guided Thermal Face Image Translation based on Latent Diffusion Model,2,10,2025,-0.07211736595738047,0.28202000284510387
121,Critical Points of Degenerate Metrics on Algebraic Varieties: A Tale of Overparametrization,14,10,2025,-0.18383531124212082,-0.19492612560194406
122,Artificial or Just Artful? Do LLMs Bend the Rules in Programming?,17,10,2025,0.3158347216767992,-0.13818980902313405
123,Policy-Conditioned Policies for Multi-Agent Task Solving,1,10,2025,0.12144076577306598,-0.2967343780744758
124,Towards Better Search with Domain-Aware Text Embeddings for C2C Marketplaces,2,10,2025,0.06969848278722773,0.03282959072292875
125,Enhancing diffusion models with Gaussianization preprocessing,11,10,2025,0.02185738045318524,0.2225072385122779
126,Efficient and Robust Video Defense Framework against 3D-field Personalized Talking Face,16,10,2025,-0.07075416467108668,0.44663385008802403
127,Rethinking Supervised Fine-Tuning: Emphasizing Key Answer Tokens for Improved LLM Accuracy,5,10,2025,0.2580562561083563,-0.04991460406505944
128,FluencyVE: Marrying Temporal-Aware Mamba with Bypass Attention for Video Editing,16,10,2025,0.01173114181676801,0.39927089584929826
129,Granular-ball Guided Masking: Structure-aware Data Augmentation,3,10,2025,-0.06632153151451589,0.07680786269857923
130,LLM Swiss Round: Aggregating Multi-Benchmark Performance via Competitive Swiss-System Dynamics,5,10,2025,0.2379557650067358,-0.06135882238603532
131,ESCHER: Efficient and Scalable Hypergraph Evolution Representation with Application to Triad Counting,14,10,2025,-0.10488996309984658,-0.007314558560236846
132,GateBreaker: Gate-Guided Attacks on Mixture-of-Expert LLMs,17,10,2025,0.15110893071426373,-0.10484514428374538
133,Learning from Neighbors with PHIBP: Predicting Infectious Disease Dynamics in Data-Sparse Environments,3,10,2025,-0.1745268550512069,-0.025176123776948448
134,Learning from Next-Frame Prediction: Autoregressive Video Modeling Encodes Effective Representations,16,10,2025,0.04226564089793844,0.32667108834357605
135,MVInverse: Feed-forward Multi-view Inverse Rendering in Seconds,2,10,2025,0.04640332225419447,0.13829650669550747
136,Distilling the Essence: Efficient Reasoning Distillation via Sequence Truncation,15,10,2025,0.32042541932360386,-0.12367193490002823
137,CoSeNet: A Novel Approach for Optimal Segmentation of Correlation Matrices,14,11,2025,-0.25397133930959787,-0.1109942742489682
138,LLM-Empowered Agentic AI for QoE-Aware Network Slicing Management in Industrial IoT,18,12,2025,-0.006606418770333315,-0.21518964141339372
139,TrafficSimAgent: A Hierarchical Agent Framework for Autonomous Traffic Simulation with MCP Control,0,13,2025,0.03988452046369472,-0.16538885573392853
140,Multimodal Sensing for Robot-Assisted Sub-Tissue Feature Detection in Physiotherapy Palpation,9,14,2025,-0.04099873134768425,0.143936579192814
141,FinAgent: An Agentic AI Framework Integrating Personal Finance and Nutrition Planning,18,15,2025,-0.0067932314388200144,-0.1785624811650636
142,Mental Health Self-Disclosure on Social Media throughout the Pandemic Period,14,16,2025,-0.12461235035795938,-0.05464448472300967
143,PUFM++: Point Cloud Upsampling via Enhanced Flow Matching,2,17,2025,-0.005659091891478989,0.13141954802039701
144,AegisAgent: An Autonomous Defense Agent Against Prompt Injection Attacks in LLM-HARs,5,18,2025,0.2592414686551432,-0.2699169499194896
145,A Blockchain-Monitored Agentic AI Architecture for Trusted Perception-Reasoning-Action Pipelines,18,19,2025,0.05925720624214069,-0.17474249430720037
146,Knowledge-Driven 3D Semantic Spectrum Map: KE-VQ-Transformer Based UAV Semantic Communication and Map Completion,6,20,2025,-0.055529577729560145,0.06660705441714941
147,Automatic Replication of LLM Mistakes in Medical Conversations,5,21,2025,0.3539509528730294,-0.1858855397621406
148,Leveraging Overfitting for Low-Complexity and Modality-Agnostic Joint Source-Channel Coding,14,22,2025,-0.09688730966186856,0.019457345996597455
149,X-ray Insights Unleashed: Pioneering the Enhancement of Multi-Label Long-Tail Data,11,23,2025,-0.026708168061778288,0.14042173894896437
150,GenTSE: Enhancing Target Speaker Extraction via a Coarse-to-Fine Generative Language Model,3,24,2025,0.08088315605439782,0.07856882052153699
151,XGrid-Mapping: Explicit Implicit Hybrid Grid Submaps for Efficient Incremental Neural LiDAR Mapping,2,10,2025,-0.14048482128223003,0.05853767107227434
152,SPOT!: Map-Guided LLM Agent for Unsupervised Multi-CCTV Dynamic Object Tracking,0,10,2025,-0.048283457271409105,-0.016119855420293958
153,Generalised Linear Models in Deep Bayesian RL with Learnable Basis Functions,10,10,2025,-0.15985914012848274,-0.11936927119485033
154,DAO-Agent: Zero Knowledge-Verified Incentives for Decentralized Multi-Agent Coordination,0,10,2025,0.07677535499778458,-0.18825851640493457
155,Mesh-Attention: A New Communication-Efficient Distributed Attention with Improved Data Locality,10,10,2025,-0.08060391348637375,0.024829254648568024
156,Deadline-Aware Online Scheduling for LLM Fine-Tuning with Spot Market Predictions,1,10,2025,-0.11192959401857451,-0.09961854669814584
157,Neutralization of IMU-Based GPS Spoofing Detection using external IMU sensor and feedback methodology,9,10,2025,-0.13963189197106096,-0.033182589034879376
158,Generalization of Diffusion Models Arises with a Balanced Representation Space,11,10,2025,-0.06509006493940964,0.17947539056785594
159,Time-Bucketed Balance Records: Bounded-Storage Ephemeral Tokens for Resource-Constrained Systems,14,10,2025,-0.16684982779231394,-0.07479990286538744
160,Fairness in the k-Server Problem,14,10,2025,-0.17488498198104666,-0.12039191809535912
161,Can Agentic AI Match the Performance of Human Data Scientists?,18,10,2025,0.08851767396569518,-0.14628983308956814
162,ReACT-Drug: Reaction-Template Guided Reinforcement Learning for de novo Drug Design,1,10,2025,-0.08527020150858729,-0.10260050290683739
163,One Tool Is Enough: Reinforcement Learning for Repository-Level LLM Agents,5,10,2025,0.13650242777899443,-0.1337666026496966
164,Solving Functional PDEs with Gaussian Processes and Applications to Functional Renormalization Group Equations,14,10,2025,-0.19027935977510665,-0.0740781664300221
165,Reflection Pretraining Enables Token-Level Self-Correction in Biological Sequence Models,15,10,2025,0.38233033019765494,-0.11923969681427338
166,Diving into 3D Parallelism with Heterogeneous Spot Instance GPUs: Design and Implications,6,10,2025,0.03274114749842055,0.06387480425849805
167,From Human Bias to Robot Choice: How Occupational Contexts and Racial Priming Shape Robot Selection,0,10,2025,0.10992595165985065,-0.16086471783077
168,MultiMind at SemEval-2025 Task 7: Crosslingual Fact-Checked Claim Retrieval via Multi-Source Alignment,3,10,2025,0.015521827382145964,-0.03429750581654344
169,Neural Probe-Based Hallucination Detection for Large Language Models,9,10,2025,0.050947495653405214,-0.01142476954902906
170,"Foundation Model-based Evaluation of Neuropsychiatric Disorders: A Lifespan-Inclusive, Multi-Modal, and Multi-Lingual Study",2,10,2025,0.07484135851845977,0.04798706975016031
171,SLIDE: Simultaneous Model Downloading and Inference at the Wireless Network Edge,14,10,2025,-0.0835694142729995,-0.0849448375948761
172,SACodec: Asymmetric Quantization with Semantic Anchoring for Low-Bitrate High-Fidelity Neural Speech Codecs,2,10,2025,-0.01909419444872963,0.1151181229143221
173,AirGS: Real-Time 4D Gaussian Streaming for Free-Viewpoint Video Experiences,16,10,2025,-0.046513026516157345,0.2533385443866942
174,A Multi-fidelity Double-Delta Wing Dataset and Empirical Scaling Laws for GNN-based Aerodynamic Field Surrogate,3,10,2025,-0.09165173445229177,-0.012271773105106834
175,ETP-R1: Evolving Topological Planning with Reinforcement Fine-tuning for Vision-Language Navigation in Continuous Environments,8,10,2025,0.08276251452723607,-0.022550168450252553
176,Stochastic well-structured transition systems,14,10,2025,-0.04841911850593399,-0.15426585965789913
177,Pioneering Multimodal Emotion Recognition in the Era of Large Models: From Closed Sets to Open Vocabularies,13,10,2025,0.3329145405217816,0.01636827082471258
178,Beyond Artifacts: Real-Centric Envelope Modeling for Reliable AI-Generated Image Detection,9,10,2025,0.00018152425708272183,0.1724669623185838
179,Reasoning-Driven Amodal Completion: Collaborative Agents and Perceptual Evaluation,15,10,2025,0.2586280221443286,0.02390597858891564
180,Transductive Visual Programming: Evolving Tool Libraries from Experience for Spatial Reasoning,12,10,2025,0.2384005028590877,0.1625631997008697
181,Guardrailed Elasticity Pricing: A Churn-Aware Forecasting Playbook for Subscription Strategy,14,10,2025,-0.1260647770209265,-0.04478933371806961
182,Certifiable Alignment of GNSS and Local Frames via Lagrangian Duality,14,10,2025,-0.11998033027864256,-0.027240951379703022
183,Decoding Predictive Inference in Visual Language Processing via Spatiotemporal Neural Coherence,10,10,2025,-0.07335421578648864,0.012783676241937181
184,Quantile Rendering: Efficiently Embedding High-dimensional Feature on 3D Gaussian Splatting,6,10,2025,-0.11440759350747805,0.29422203361111066
185,"Uncovering Hierarchical Structure in LLM Embeddings with $δ$-Hyperbolicity, Ultrametricity, and Neighbor Joining",5,10,2025,0.1776315296024547,-0.21563038559223094
