paper_id,title,cluster,citations,year,pca_x,pca_y
371,Inverse Autoregressive Flows for Zero Degree Calorimeter fast simulation,3,10,2025,-0.10167375728145144,-0.055156332313442843
372,A Comprehensive Study of Bugs in Modern Distributed Deep Learning Systems,10,10,2025,-0.15771981974147015,-0.1325310110397585
373,A DeepSeek-Powered AI System for Automated Chest Radiograph Interpretation in Clinical Practice,18,10,2025,0.13972806536322552,-0.016011913458791743
374,Design and Modeling of a Simple-Structured Continuously Variable Transmission Utilizing Shape Memory Alloy Superelasticity for Twisted String Actuator,2,10,2025,-0.04645129019492953,-0.02528218366476403
375,The devil is in the details: Enhancing Video Virtual Try-On via Keyframe-Driven Details Injection,16,10,2025,-0.03227896122001955,0.28165495793182016
376,MMEDIT: A Unified Framework for Multi-Type Audio Editing via Audio Language Model,3,10,2025,0.049462570239096254,0.17533547169579866
377,Comment Traps: How Defective Commented-out Code Augment Defects in AI-Assisted Code Generation,17,10,2025,0.1818026176298619,-0.05074826731342858
378,SynCraft: Guiding Large Language Models to Predict Edit Sequences for Molecular Synthesizability Optimization,15,10,2025,0.23623047171800474,-0.04167244404539612
379,RIS-Empowered OTFS Modulation With Faster-than-Nyquist Signaling in High-Mobility Wireless Communications,2,10,2025,-0.09078834088754176,-0.008129108310295029
380,FedDPC : Handling Data Heterogeneity and Partial Client Participation in Federated Learning,3,10,2025,-0.10719552767905892,0.04998081792564989
381,Toward Explaining Large Language Models in Software Engineering Tasks,17,10,2025,0.35065601395915197,-0.08618372050762055
382,"Top-K Exterior Power Persistent Homology: Algorithm, Structure, and Stability",14,10,2025,-0.20602393929093893,-0.09824532509829473
383,Can LLMs Solve My Grandma's Riddle? Evaluating Multilingual Large Language Models on Reasoning Traditional Bangla Tricky Riddles,15,10,2025,0.49466293441223835,-0.1277191502891912
384,Differentially Private Feature Release for Wireless Sensing: Adaptive Privacy Budget Allocation on CSI Spectrograms,2,10,2025,-0.14316513711570308,0.09639632527025899
385,Pneumatic bladder links with wide range of motion joints for articulated inflatable robots,4,10,2025,-0.13662328464091306,0.04916788815440366
386,Deep Learning Classification of EEG Responses to Multi-Dimensional Transcranial Electrical Stimulation,10,10,2025,-0.14890097838209207,-0.11032259804221746
387,TableGPT-R1: Advancing Tabular Reasoning Through Reinforcement Learning,15,11,2025,0.33792968339484675,-0.10628981208356211
388,Algorithm for Interpretable Graph Features via Motivic Persistent Cohomology,8,12,2025,-0.1887579912597371,-0.04008161700037079
389,SpidR: Learning Fast and Stable Linguistic Units for Spoken Language Models Without Supervision,2,13,2025,0.07158540514565238,-0.006227845963711846
390,Structured Visualization Design Knowledge for Grounding Generative Reasoning and Situated Feedback,15,14,2025,0.20070705580437165,-0.10995804198154747
391,KAN-AFT: An Interpretable Nonlinear Survival Model Integrating Kolmogorov-Arnold Networks with Accelerated Failure Time Analysis,10,15,2025,-0.13050768998887988,-0.10462479313678892
392,From the Two-Capacitor Paradox to Electromagnetic Side-Channel Mitigation in Digital Circuits,14,16,2025,0.018626315860335214,0.004007213688644271
393,Ferroelectric FET-based Logic-in-Memory Encoder for Hyperdimensional Computing,2,17,2025,-0.08354671283642975,-0.060228714583942584
394,KnowVal: A Knowledge-Augmented and Value-Guided Autonomous Driving System,12,18,2025,0.19888269232693626,-0.05617723010991138
395,Patterns vs. Patients: Evaluating LLMs against Mental Health Professionals on Personality Disorder Diagnosis through First-Person Narratives,17,19,2025,0.3015306550216706,-0.15288830159394393
396,TAVID: Text-Driven Audio-Visual Interactive Dialogue Generation,12,20,2025,0.13405345713356542,0.3230505792531044
397,AprielGuard,15,21,2025,0.3440011559209489,-0.15292348505198908
398,SlideTailor: Personalized Presentation Slide Generation for Scientific Papers,16,22,2025,0.09280437479658234,0.25311739856626453
399,Mixture-of-Experts with Gradient Conflict-Driven Subspace Topology Pruning for Emergent Modularity,14,23,2025,-0.0010418901680371141,-0.01782326798490365
400,UbiQVision: Quantifying Uncertainty in XAI for Image Recognition,10,24,2025,-0.1296362312627358,0.06463606750302918
401,"Replacing Gas with Low-cost, Abundant Long-duration Pumped Hydro in Electricity Systems",14,10,2025,-0.06972684542068845,0.021491825026141987
402,Auditing Reproducibility in Non-Targeted Analysis: 103 LC/GC--HRMS Tools Reveal Temporal Divergence Between Openness and Operability,3,10,2025,-0.054925177191036643,-0.08922008096136069
403,Synthesizing Procedural Memory: Challenges and Architectures in Automated Workflow Generation,17,10,2025,0.15127536755145948,0.01341060267614185
404,ActionFlow: A Pipelined Action Acceleration for Vision Language Models on Edge,12,10,2025,0.06547838146896885,0.07907931936985436
405,Graph-Symbolic Policy Enforcement and Control (G-SPEC): A Neuro-Symbolic Framework for Safe Agentic AI in 5G Autonomous Networks,1,10,2025,-0.07101963392290364,-0.25571559326761695
406,HGAN-SDEs: Learning Neural Stochastic Differential Equations with Hermite-Guided Adversarial Training,10,10,2025,-0.2409190169364731,-0.05337010582213184
407,Automated Training of Learned Database Components with Generative AI,3,10,2025,-0.07349063297246328,-0.021497578569599263
408,Optimality-Informed Neural Networks for Solving Parametric Optimization Problems,10,10,2025,-0.32789919668191436,-0.14772180851741928
409,DeepONet-accelerated Bayesian inversion for moving boundary problems,10,10,2025,-0.2686003492609422,-0.07351411004128379
410,Maximizing the Egalitarian Welfare in Friends and Enemies Games,0,10,2025,-0.08097406283675598,-0.2159046123062219
411,${D}^{3}${ETOR}: ${D}$ebate-Enhanced Pseudo Labeling and Frequency-Aware Progressive ${D}$ebiasing for Weakly-Supervised Camouflaged Object ${D}$etection with Scribble Annotations,2,10,2025,0.03188235014196267,0.11630796468896884
412,LADLE-MM: Limited Annotation based Detector with Learned Ensembles for Multimodal Misinformation,13,10,2025,0.0981093633525168,0.20204251378661947
413,BiCoR-Seg: Bidirectional Co-Refinement Framework for High-Resolution Remote Sensing Image Segmentation,2,10,2025,-0.05215318044879754,0.10541559350219422
414,Degradation-Aware Metric Prompting for Hyperspectral Image Restoration,2,10,2025,-0.038730553011202,0.19291087021427802
415,Unified Multimodal Brain Decoding via Cross-Subject Soft-ROI Fusion,13,10,2025,0.05950499824228979,0.13849798306136205
416,Memory as Resonance: A Biomimetic Architecture for Infinite Context Memory on Ergodic Phonetic Manifolds,2,10,2025,0.07267433583708965,-0.006431791058293447
417,Post-Quantum Cryptography in the 5G Core,7,10,2025,-0.211650615142126,-0.1488364214232294
418,Hierarchical Rectangle Packing Solved by Multi-Level Recursive Logic-based Benders Decomposition,14,10,2025,-0.14537453319609386,-0.015302909701701648
419,MemR$^3$: Memory Retrieval via Reflective Reasoning for LLM Agents,5,10,2025,0.1598181868971917,-0.1300495858595485
420,IndicDLP: A Foundational Dataset for Multi-Lingual and Multi-Domain Document Layout Parsing,2,10,2025,0.1729126501886781,0.05823182311319205
421,Achieving Flexible and Secure Authentication with Strong Privacy in Decentralized Networks,10,10,2025,-0.1372586268472458,-0.050344397770491094
422,How I Met Your Bias: Investigating Bias Amplification in Diffusion Models,11,10,2025,0.08474297801468632,0.21006079417262813
423,Adaptive Multi-task Learning for Probabilistic Load Forecasting,14,10,2025,-0.18438288248925336,-0.08994431023305133
424,Finite-Time Control Based on Differential Flatness for Wheeled Mobile Robots with Experimental Validation,14,10,2025,-0.14553069422045567,-0.005935563885401552
425,Evaluating Moderation in Online Social Network,14,10,2025,-0.120922307640804,-0.08482459974181318
426,UrbanV2X: A Multisensory Vehicle-Infrastructure Dataset for Cooperative Navigation in Urban Areas,3,10,2025,-0.05911276426832653,0.011214354583268108
427,The Effect of Empathic Expression Levels in Virtual Human Interaction: A Controlled Experiment,0,10,2025,0.028760849248900842,-0.09182021499012574
428,Generalisation in Multitask Fitted Q-Iteration and Offline Q-learning,1,10,2025,-0.15260726621869028,-0.13802830587817752
429,Cost-TrustFL: Cost-Aware Hierarchical Federated Learning with Lightweight Reputation Evaluation across Multi-Cloud,10,10,2025,-0.14926913110433013,-0.04748212857967555
430,LiteFusion: Taming 3D Object Detectors from Vision-Based to Multi-Modal with Minimal Adaptation,6,10,2025,-0.06111806911330626,0.2614954775424698
431,"Error Localization, Certificates, and Hints for Probabilistic Program Verification via Slicing (Extended Version)",14,10,2025,-0.08176105317216699,-0.0815853164723485
432,JDPNet: A Network Based on Joint Degradation Processing for Underwater Image Enhancement,2,10,2025,-0.14920700111525087,0.0866428898817403
433,Aliasing-Free Neural Audio Synthesis,2,10,2025,-0.058924000840218094,0.06832688741991917
434,Predictive-LoRA: A Proactive and Fragmentation-Aware Serverless Inference System for LLMs,5,10,2025,0.08991068000075787,-0.14730357151119503
435,TongSIM: A General Platform for Simulating Intelligent Machines,0,10,2025,0.26047466704772726,-0.08041011429031263
436,Corpus of Cross-lingual Dialogues with Minutes and Detection of Misunderstandings,9,10,2025,0.14277400803835838,0.019013501800279376
437,Well Begun is Half Done: Location-Aware and Trace-Guided Iterative Automated Vulnerability Repair,5,11,2025,0.07534571297439836,-0.041317188196806375
438,Designing Spatial Architectures for Sparse Attention: STAR Accelerator via Cross-Stage Tiling,2,12,2025,0.04591049481563734,0.046883904656767866
439,Generative Latent Coding for Ultra-Low Bitrate Image Compression,2,13,2025,0.018078094985628252,0.2503093153712429
440,Asynchronous Fast-Slow Vision-Language-Action Policies for Whole-Body Robotic Manipulation,12,14,2025,0.12419266390201494,0.03790459716774095
441,Edge-Served Congestion Control for Wireless Multipath Transmission with a Transformer Agent,10,15,2025,-0.1946297221233732,-0.12694277099698723
442,Reaching Agreement Among Reasoning LLM Agents,0,16,2025,0.2644715208748293,-0.23245082476086165
443,FaithLens: Detecting and Explaining Faithfulness Hallucination,3,17,2025,0.1057844611230491,-0.03267941070646286
444,Competing or Collaborating? The Role of Hackathon Formats in Shaping Team Dynamics and Project Choices,14,18,2025,-0.1929828451630403,-0.1180403150656252
445,Approximation and parameterized algorithms for covering disjointness-compliable set families,14,19,2025,-0.14961531495806793,-0.11937216464831364
446,RESPOND: Risk-Enhanced Structured Pattern for LLM-driven Online Node-level Decision-making,5,20,2025,0.10434070738399559,-0.11862593840389145
447,SHIRO: Near-Optimal Communication Strategies for Distributed Sparse Matrix Multiplication,10,21,2025,-0.1585738120608542,-0.039086697494855036
448,NeuralCrop: Combining physics and machine learning for improved crop yield predictions,3,22,2025,-0.11099733354494563,-0.04809285671705226
449,Optimistic TEE-Rollups: A Hybrid Architecture for Scalable and Verifiable Generative AI Inference on Blockchain,2,23,2025,0.03486103801828282,-0.09088779090977198
450,Towards Natural Language-Based Document Image Retrieval: New Dataset and Benchmark,13,24,2025,0.21190686564422997,0.25052151282617413
451,Offline Safe Policy Optimization From Heterogeneous Feedback,1,10,2025,-0.01619945921377341,-0.18352650171306406
452,Collaborative Group-Aware Hashing for Fast Recommender Systems,2,10,2025,-0.12262420530777574,0.015759015880252462
453,Learning to Reason in LLMs by Expectation Maximization,15,10,2025,0.39376865091655766,-0.2498028621187872
454,Odysseus: Jailbreaking Commercial Multimodal LLM-integrated Systems via Dual Steganography,13,10,2025,0.15957302291597333,-0.06311778437536178
455,LoLA: Long Horizon Latent Action Learning for General Robot Manipulation,12,10,2025,0.15276498912968212,0.12301299401640002
456,Spectral or spatial? Leveraging both for speaker extraction in challenging data conditions,2,10,2025,-0.16750089126212997,-0.00490928060344098
457,AI Security Beyond Core Domains: Resume Screening as a Case Study of Adversarial Vulnerabilities in Specialized LLM Applications,17,10,2025,0.22669512755413154,-0.13431637074240127
458,Population Protocols Revisited: Parity and Beyond,14,10,2025,-0.12779658329299867,-0.019966100794432354
459,Concept Generalization in Humans and Large Language Models: Insights from the Number Game,17,10,2025,0.3193298898292128,-0.22188688097445877
460,A Bidirectional Gated Recurrent Unit Model for PUE Prediction in Data Centers,3,10,2025,-0.20303903682039978,-0.06722973232045208
461,AXIOM: Benchmarking LLM-as-a-Judge for Code via Rule-Based Perturbation and Multisource Quality Calibration,17,10,2025,0.2601492870890114,-0.02991598109413479
462,AMoE: Agglomerative Mixture-of-Experts Vision Foundation Model,12,10,2025,0.017976430589657443,0.08550503756670894
463,Fun-Audio-Chat Technical Report,5,10,2025,0.2743099621075178,0.10559511665239511
464,CoDi -- an exemplar-conditioned diffusion model for low-shot counting,11,10,2025,-0.040585522356982644,0.1609585305362833
465,QuarkAudio Technical Report,2,10,2025,0.10885578442460751,0.10845369782369506
466,Enhancing annotations for 5D apple pose estimation through 3D Gaussian Splatting (3DGS),6,10,2025,-0.0574935495112521,0.21266822418259732
467,Retrieval-augmented Prompt Learning for Pre-trained Foundation Models,3,10,2025,-0.01699241322846502,-0.029328523464317763
468,Multi-hop Reasoning via Early Knowledge Alignment,15,10,2025,0.27718121787127264,-0.10099133698726652
469,Enhancing Zero-Shot Time Series Forecasting in Off-the-Shelf LLMs via Noise Injection,17,10,2025,0.21712978370119554,-0.1410608268518998
470,M$^3$KG-RAG: Multi-hop Multimodal Knowledge Graph-enhanced Retrieval-Augmented Generation,13,10,2025,0.21967301288178726,0.09338035883263159
471,MolAct: An Agentic RL Framework for Molecular Editing and Property Optimization,1,10,2025,0.05684360243642554,-0.1818734990820731
472,"Dreamcrafter: Immersive Editing of 3D Radiance Fields Through Flexible, Generative Inputs and Outputs",6,10,2025,-0.021081272572857718,0.2006349243247415
473,milliMamba: Specular-Aware Human Pose Estimation via Dual mmWave Radar with Multi-Frame Mamba Fusion,4,10,2025,0.003615372054317163,0.12837008600804203
474,HEART-VIT: Hessian-Guided Efficient Dynamic Attention and Token Pruning in Vision Transformer,12,10,2025,-0.015159347986111614,0.11323135792066706
475,DDAVS: Disentangled Audio Semantics and Delayed Bidirectional Alignment for Audio-Visual Segmentation,12,10,2025,0.08436715855552641,0.2393270183493444
476,/UnmuteAll: Modeling Verbal Communication Patterns of Collaborative Contexts in MOBA Games,10,10,2025,-0.1581360427559051,-0.07727882377764643
477,Sample-Efficient Policy Constraint Offline Deep Reinforcement Learning based on Sample Filtering,1,10,2025,-0.16003555800797037,-0.09329368578160381
478,Multi Modal Attention Networks with Uncertainty Quantification for Automated Concrete Bridge Deck Delamination Detection,9,10,2025,-0.09324472709241671,0.11793983420436824
479,Evolutionary Neural Architecture Search with Dual Contrastive Learning,10,10,2025,-0.24403705100225045,-0.06822715826254788
480,ABBEL: LLM Agents Acting through Belief Bottlenecks Expressed in Language,0,10,2025,0.20325234614689833,-0.11780237177387168
481,Generative Bayesian Spectrum Cartography: Unified Reconstruction and Active Sensing via Diffusion Models,11,10,2025,-0.062311639371370894,0.15043083980000144
482,UMAMI: Unifying Masked Autoregressive Models and Deterministic Rendering for View Synthesis,11,10,2025,-0.09510673012835257,0.3556312103645997
483,LiDARDraft: Generating LiDAR Point Cloud from Versatile Inputs,6,10,2025,0.013876140646480926,0.3560192460078727
484,Effect of Activation Function and Model Optimizer on the Performance of Human Activity Recognition System Using Various Deep Learning Models,10,10,2025,-0.15605359523884765,-0.16105179559192093
485,Developing an NTN Architecture for End-to-End Performance Evaluation,14,10,2025,-0.09724187485620786,-0.03647411092694066
486,A Novel Graph-Sequence Learning Model for Inductive Text Classification,8,10,2025,-0.09642708444006949,0.04410785376931544
487,Information-directed sampling for bandits: a primer,1,11,2025,-0.13126103547183615,-0.13500841989027842
488,Jensen-Shannon Divergence Message-Passing for Rich-Text Graph Representation Learning,8,12,2025,-0.17353703789267788,0.030440298302689465
489,Neural Compression of 360-Degree Equirectangular Videos using Quality Parameter Adaptation,16,13,2025,-0.16909470623733197,0.10102762642915221
490,Memory-T1: Reinforcement Learning for Temporal Reasoning in Multi-session Agents,0,14,2025,0.13150747181210123,-0.052369948611448926
491,Item Region-based Style Classification Network (IRSN): A Fashion Style Classifier Based on Domain Knowledge of Fashion Experts,2,15,2025,-0.05964340905260296,0.07714769460069817
492,Spatio-Temporal Graphs Beyond Grids: Benchmark for Maritime Anomaly Detection,9,16,2025,-0.05556243082101923,-0.02389377397050812
493,QE-Catalytic: A Graph-Language Multimodal Base Model for Relaxed-Energy Prediction in Catalytic Adsorption,8,17,2025,-0.016793410729448035,-0.00900743592944273
494,Detecting Non-Optimal Decisions of Embodied Agents via Diversity-Guided Metamorphic Testing,0,18,2025,-0.024465023290464693,-0.05328406239156524
495,"Adaptive Financial Sentiment Analysis for NIFTY 50 via Instruction-Tuned LLMs , RAG and Reinforcement Learning Approaches",1,19,2025,0.04623129035538276,-0.14634369981263554
496,CBA: Communication-Bound-Aware Cross-Domain Resource Assignment for Pipeline-Parallel Distributed LLM Training in Dynamic Multi-DC Optical Networks,10,20,2025,-0.048416773473296516,-0.01025025734132059
497,Fault Injection Attacks on Machine Learning-based Quantum Computer Readout Error Correction,7,21,2025,-0.18457336231380178,-0.14226528023531665
498,Reason2Decide: Rationale-Driven Multi-Task Learning,5,22,2025,0.30784613973604813,-0.09321076226109334
499,3D Stack In-Sensor-Computing (3DS-ISC): Accelerating Time-Surface Construction for Neuromorphic Event Cameras,6,23,2025,-0.1645530475557563,0.1778194655593441
500,Progressive Learned Image Compression for Machine Perception,2,24,2025,-0.0696603752937163,0.0848339679922866
501,FastMPS: Revisit Data Parallel in Large-scale Matrix Product State Sampling,3,10,2025,-0.09595547945366037,-0.06124994401836233
502,PairFlow: Closed-Form Source-Target Coupling for Few-Step Generation in Discrete Flow Models,3,10,2025,0.03241883099066413,0.08024961338452288
503,On the Effectiveness of Instruction-Tuning Local LLMs for Identifying Software Vulnerabilities,17,10,2025,0.2965962645454832,-0.2598930306958994
504,Scaling Reinforcement Learning for Content Moderation with Large Language Models,1,10,2025,0.196794099908663,-0.20396810306532168
505,DS-HGCN: A Dual-Stream Hypergraph Convolutional Network for Predicting Student Engagement via Social Contagion,2,10,2025,-0.1500407154852489,0.051876053759586066
506,Deep Eigenspace Network and Its Application to Parametric Non-selfadjoint Eigenvalue Problems,10,10,2025,-0.22005256775099657,-0.10079677707041676
507,Towards Generative Location Awareness for Disaster Response: A Probabilistic Cross-view Geolocalization Approach,2,10,2025,-0.019983714845618616,0.10217776142085754
508,An Optimal Policy for Learning Controllable Dynamics by Exploration,1,10,2025,-0.18227906235722868,-0.17197183976807168
509,Learning Skills from Action-Free Videos,16,10,2025,-0.00158362687178589,0.23274656683634617
510,Self-motion as a structural prior for coherent and robust formation of cognitive maps,4,10,2025,-0.06465837545750364,0.11282821016954607
511,Discovering Lie Groups with Flow Matching,3,10,2025,-0.1597223750486828,-0.024282015036172378
512,Beyond Vision: Contextually Enriched Image Captioning with Multi-Modal Retrieva,13,10,2025,0.09558023364218446,0.32127299421226035
513,Optimal Anytime-Valid Tests for Composite Nulls,14,10,2025,-0.19357235270160777,-0.09767347807066831
514,VSA:Visual-Structural Alignment for UI-to-Code,12,10,2025,0.16849222217147286,0.1503402523538231
515,FlashLips: 100-FPS Mask-Free Latent Lip-Sync using Reconstruction Instead of Diffusion or GANs,11,10,2025,-0.03338286959154398,0.25890227145225886
516,VALLR-Pin: Dual-Decoding Visual Speech Recognition for Mandarin with Pinyin-Guided LLM Refinement,5,10,2025,0.20795932143502704,0.16762670695896809
517,$\text{H}^2$em: Learning Hierarchical Hyperbolic Embeddings for Compositional Zero-Shot Learning,2,10,2025,-0.04527329171895637,0.12276146424457834
518,DecoKAN: Interpretable Decomposition for Forecasting Cryptocurrency Market Dynamics,2,10,2025,-0.14343354865729266,-0.061068555158988354
519,MAPI-GNN: Multi-Activation Plane Interaction Graph Neural Network for Multimodal Medical Diagnosis,8,10,2025,-0.16067385296702036,-0.008235003167280212
520,A Contextual Analysis of Driver-Facing and Dual-View Video Inputs for Distraction Detection in Naturalistic Driving Environments,9,10,2025,0.0017976514885107038,0.0670660185645757
521,All-optical 3-input OR and 2-input AND/NIMPLY logic gates in a linear planar three-core optical fiber coupler,14,10,2025,-0.16453814052060148,-0.011631950016009956
522,LLM-Assisted Abstract Screening with OLIVER: Evaluating Calibration and Single-Model vs. Actor-Critic Configurations in Literature Reviews,5,10,2025,0.24657419125405705,-0.15881126382541022
523,Gaussian Process Assisted Meta-learning for Image Classification and Object Detection Models,3,10,2025,-0.165775888641279,0.0469063746310548
524,A hybrid global local computational framework for ship hull structural analysis using homogenized model and graph neural network,8,10,2025,-0.1935158455962741,-0.02007695121474956
525,Scaling Point-based Differentiable Rendering for Large-scale Reconstruction,10,10,2025,-0.13253265189691563,0.03347676355093385
526,HeylandCircle: A Computational Framework for the Geometric Reconstruction of the Heyland Circle Diagram,14,10,2025,-0.13514248064461692,-0.04791233162832886
527,Bring My Cup! Personalizing Vision-Language-Action Models with Visual Attentive Prompting,12,10,2025,0.1087590352329314,0.24062344506210115
528,SegEarth-R2: Towards Comprehensive Language-guided Segmentation for Remote Sensing Images,12,10,2025,0.25216893772340765,0.06858137124720463
529,Reliable LLM-Based Edge-Cloud-Expert Cascades for Telecom Knowledge Systems,5,10,2025,0.05505786076898426,-0.18179936642907757
530,PaveSync: A Unified and Comprehensive Dataset for Pavement Distress Analysis and Classification,9,10,2025,0.016890852305530148,0.17018607370750746
531,Semiparametric KSD test: unifying score and distance-based approaches for goodness-of-fit testing,14,10,2025,-0.11240565861395264,-0.06890659570840613
532,Orthogonal Activation with Implicit Group-Aware Bias Learning for Class Imbalance,3,10,2025,-0.25553828078232277,-0.07925141788912177
533,IoT-based Android Malware Detection Using Graph Neural Network With Adversarial Defense,8,10,2025,-0.2653529163848915,-0.1106123315962151
534,Control Variate Score Matching for Diffusion Models,11,10,2025,-0.11417963583190328,0.07931062343112176
535,LoFT-LLM: Low-Frequency Time-Series Forecasting with Large Language Models,5,10,2025,0.17732069153029334,-0.05311105357140229
536,Few-Shot-Based Modular Image-to-Video Adapter for Diffusion Models,4,10,2025,0.015072145955771908,0.39694236479457656
537,Stories That Teach: Eastern Wisdom for Human-AI Creative Partnerships,18,11,2025,0.08931837687085137,-0.06515388704206895
538,BacAlarm: Mining and Simulating Composite API Traffic to Prevent Broken Access Control Violations,9,12,2025,-0.19411199918469085,-0.040160957832493974
539,Schoenfeld's Anatomy of Mathematical Reasoning by Language Models,15,13,2025,0.40678071243101915,-0.17899369164794604
540,S$^3$IT: A Benchmark for Spatially Situated Social Intelligence Test,0,14,2025,0.3125910608566857,-0.14187785905126288
541,Bloom Filter Encoding for Machine Learning,10,15,2025,-0.25769174484793284,-0.14515658933691125
542,A Dual-Branch Local-Global Framework for Cross-Resolution Land Cover Mapping,2,16,2025,0.07148418939675187,0.14543959735438902
543,A Novel CNN Gradient Boosting Ensemble for Guava Disease Detection,9,17,2025,-0.0929079242762321,-0.007873536265133681
544,Covariance-Aware Simplex Projection for Cardinality-Constrained Portfolio Optimization,14,18,2025,-0.10038839660675247,-0.04065045178859657
545,IGDMRec: Behavior Conditioned Item Graph Diffusion for Multimodal Recommendation,8,19,2025,-0.08630444499264625,0.11671979839307069
546,WSD-MIL: Window Scale Decay Multiple Instance Learning for Whole Slide Image Classification,2,20,2025,-0.08825116731237705,0.09368923594000918
547,"Neuron-Guided Interpretation of Code LLMs: Where, Why, and How?",17,21,2025,0.33284950051269696,0.012128804107786446
548,Regression of Functions by Quantum Neural Networks Circuits,7,22,2025,-0.2122513833648151,-0.14940076755616374
549,Prediction Air Temperature in Geothermal Heat Exchangers Using Pseudorandom Numbers: The New DARL Model,3,23,2025,-0.1887962946008196,-0.06107456321655878
550,"Rethinking Knowledge Distillation in Collaborative Machine Learning: Memory, Knowledge, and Their Interactions",0,24,2025,-0.016970943695382257,-0.17743979525947945
551,Spatio-Temporal Graph Neural Networks for Dairy Farm Sustainability Forecasting and Counterfactual Policy Analysis,8,10,2025,-0.2138380430665728,-0.04668799011608278
552,Fast Deterministically Safe Proof-of-Work Consensus,14,10,2025,-0.11633874819528355,-0.06452002515912386
