paper_id,title,cluster,citations,year,pca_x,pca_y
186,Clever Hans in Chemistry: Chemist Style Signals Confound Activity Prediction on Public Benchmarks,3,10,2025,-0.07301630364695963,-0.045758912413494536
187,Self-supervised Multiplex Consensus Mamba for General Image Fusion,2,11,2025,0.019591661647020867,0.2771954934341586
188,RevFFN: Memory-Efficient Full-Parameter Fine-Tuning of Mixture-of-Experts LLMs with Reversible Blocks,17,12,2025,0.18779211414900945,-0.030927537947561857
189,MMSRARec: Summarization and Retrieval Augumented Sequential Recommendation Based on Multimodal Large Language Model,13,13,2025,0.16227950646472417,0.09879195295709743
190,Towards a General Framework for Predicting and Explaining the Hardness of Graph-based Combinatorial Optimization Problems using Machine Learning and Association Rule Mining,8,14,2025,-0.25892490182052946,-0.14197834563100514
191,Where Did This Sentence Come From? Tracing Provenance in LLM Reasoning Distillation,15,15,2025,0.27610711347172723,-0.10464021760857915
192,PanoGrounder: Bridging 2D and 3D with Panoramic Scene Representations for VLM-based 3D Visual Grounding,6,16,2025,0.1367919308307959,0.30948629271124883
193,DiEC: Diffusion Embedded Clustering,11,17,2025,-0.13874924354979373,0.1184750217240561
194,Efficient Computation of Integer-constrained Cones for Conformal Parameterizations,14,18,2025,-0.1944675589655173,-0.045194820304653965
195,Embodied AI-Enhanced IoMT Edge Computing: UAV Trajectory Optimization and Task Offloading with Mobility Prediction,18,19,2025,-0.12812841251340423,-0.16864872440416775
196,Benchmarking and Enhancing VLM for Compressed Image Understanding,12,20,2025,0.04107649997359362,0.2166179906062392
197,When Experts Speak:Sequential LLM-Bayesian Learning for Startup Success Prediction,5,21,2025,0.11716541029513694,-0.0996512407822938
198,DGSAN: Dual-Graph Spatiotemporal Attention Network for Pulmonary Nodule Malignancy Prediction,8,22,2025,-0.11355724592095227,0.13599145806980473
199,Accurate and Diverse Recommendations via Propensity-Weighted Linear Autoencoders,14,23,2025,-0.08520435092010546,-0.08451164704933788
200,Time-Efficient Evaluation and Enhancement of Adversarial Robustness in Deep Neural Networks,10,24,2025,-0.1589660004326082,-0.10834213584186114
201,Beyond Weight Adaptation: Feature-Space Domain Injection for Cross-Modal Ship Re-Identification,2,10,2025,0.012023608443946024,0.13488838449040627
202,Stretchable and High-Precision Optical Tactile Sensor for Trajectory Tracking of Parallel Mechanisms,2,10,2025,-0.08386494390669874,0.03691014015740959
203,From GNNs to Symbolic Surrogates via Kolmogorov-Arnold Networks for Delay Prediction,10,10,2025,-0.1758629517543711,-0.043419933144182306
204,The Silent Scholar Problem: A Probabilistic Framework for Breaking Epistemic Asymmetry in LLM Agents,0,10,2025,0.09337865764865667,-0.19930744212312362
205,Uplink RSMA Performance Analysis with Rate Adaptation: A Stochastic Geometry Approach,2,10,2025,-0.10134766685843762,0.010905931270942032
206,Architectural Trade-offs in Small Language Models Under Compute Constraints,2,10,2025,0.1631814865426128,0.0018778866267248632
207,Proprioception Enhances Vision Language Model in Generating Captions and Subtask Segmentations for Robot Task,4,10,2025,0.06358739558018184,0.20554268221790875
208,Better Call Graphs: A New Dataset of Function Call Graphs for Malware Classification,8,10,2025,-0.05469670202077257,0.043987824047874796
209,NeRV360: Neural Representation for 360-Degree Videos with a Viewport Decoder,16,10,2025,-0.14126550764748014,0.14078249348335836
210,In-Place BWT and Lyndon Array Construction in Constant Space,14,10,2025,-0.17182343564625638,-0.03836226136241979
211,Early warning signals for loss of control,14,10,2025,-0.09261816286481546,-0.10743713409723883
212,Lightweight framework for underground pipeline recognition and spatial localization based on multi-view 2D GPR images,6,10,2025,-0.13560179211042225,0.1259934789198533
213,Robustness Certificates for Neural Networks against Adversarial Attacks,3,10,2025,-0.17053857215366133,-0.10370311987579049
214,(Im)possibility of Incentive Design for Challenge-based Blockchain Protocols,14,10,2025,-0.09817622233075815,-0.062464813049855586
215,Memory-Efficient Acceleration of Block Low-Rank Foundation Models on Resource Constrained GPUs,2,10,2025,-0.0029474640067542893,-0.029405488409390265
216,"pokiSEC: A Multi-Architecture, Containerized Ephemeral Malware Detonation Sandbox",9,10,2025,-0.06404881030052456,0.06014824072378312
217,ALIVE: An Avatar-Lecture Interactive Video Engine with Content-Aware Retrieval for Real-Time Interaction,13,10,2025,0.04198742366369987,0.05752352317014982
218,NVIDIA Nemotron 3: Efficient and Open Intelligence,15,10,2025,0.24477871513999416,-0.06528907113540798
219,How important is Recall for Measuring Retrieval Quality?,13,10,2025,0.11084250879132586,0.013344501214947695
220,"Nemotron 3 Nano: Open, Efficient Mixture-of-Experts Hybrid Mamba-Transformer Model for Agentic Reasoning",15,10,2025,0.31184270478019455,0.014703594958171454
221,YCB-Handovers Dataset: Analyzing Object Weight Impact on Human Handovers to Adapt Robotic Handover Motion,4,10,2025,0.010739787380142382,0.09090612858174964
222,MAR:Multi-Agent Reflexion Improves Reasoning Abilities in LLMs,5,10,2025,0.3645915867592324,-0.2788021076884678
223,Input-Adaptive Visual Preprocessing for Efficient Fast Vision-Language Model Inference,12,10,2025,0.07706481587500692,0.24150771885632843
224,CHAMMI-75: pre-training multi-channel models with heterogeneous microscopy images,3,10,2025,0.05760125686144622,0.1307094743905407
225,Context-Sensitive Abstractions for Reinforcement Learning with Parameterized Actions,0,10,2025,-0.03795609056512822,-0.01407739132017857
226,"NotSoTiny: A Large, Living Benchmark for RTL Code Generation",17,10,2025,0.2785528555641903,-0.045967759832061944
227,MediEval: A Unified Medical Benchmark for Patient-Contextual and Knowledge-Grounded Reasoning in LLMs,17,10,2025,0.3429937666450583,-0.1449560819047412
228,Defending against adversarial attacks using mixture of experts,3,10,2025,-0.11407503056170101,-0.09251310134392172
229,EssayCBM: Rubric-Aligned Concept Bottleneck Models for Transparent Essay Grading,5,10,2025,0.14430940939692571,-0.06338079172081072
230,Learning to Sense for Driving: Joint Optics-Sensor-Model Co-Design for Semantic Segmentation,10,10,2025,-0.06577483303398687,-0.012530004325602822
231,FedMPDD: Communication-Efficient Federated Learning with Privacy Preservation Attributes via Projected Directional Derivative,10,10,2025,-0.19400818326623437,-0.07438727848571809
232,GraphFire-X: Physics-Informed Graph Attention Networks and Structural Gradient Boosting for Building-Scale Wildfire Preparedness at the Wildland-Urban Interface,8,10,2025,-0.15738365566473445,-0.044986161263870006
233,Semantic Deception: When Reasoning Models Can't Compute an Addition,15,10,2025,0.41926428992657944,-0.1719034141123845
234,Weighted MCC: A Robust Measure of Multiclass Classifier Performance for Observations with Individual Weights,2,10,2025,-0.04490891372241607,-0.021445924920419107
235,Hardware-Algorithm Co-Design for Hyperdimensional Computing Based on Memristive System-on-Chip,14,10,2025,-0.1570475535266104,-0.13378101935631528
236,Safety Alignment of LMs via Non-cooperative Games,0,10,2025,0.07807082984442537,-0.1098998630568546
237,A Benchmark for Evaluating Outcome-Driven Constraint Violations in Autonomous AI Agents,0,11,2025,0.20681743661859486,-0.15453048933841146
238,Assessing Coronary Microvascular Dysfunction using Angiography-based Data-driven Methods,3,12,2025,-0.18590418708766207,-0.05068969688486626
239,Measuring Mechanistic Independence: Can Bias Be Removed Without Erasing Demographics?,2,13,2025,0.02984649542991978,-0.03672200966953771
240,RHAPSODY: Execution of Hybrid AI-HPC Workflows at Scale,18,14,2025,0.03811557919788231,-0.1141518223866907
241,Investigating Model Editing for Unlearning in Large Language Models,2,15,2025,0.08372720923294387,-0.10417061891030877
242,X-GridAgent: An LLM-Powered Agentic AI System for Assisting Power Grid Analysis,5,16,2025,0.18747416630335392,-0.11591141929790719
243,Symbolic regression for defect interactions in 2D materials,10,17,2025,-0.3028105031003329,-0.11250552027508666
244,NULLBUS: Multimodal Mixed-Supervision for Breast Ultrasound Segmentation via Nullable Global-Local Prompts,13,18,2025,0.03488391925367744,0.2525575270543368
245,Soft Filtering: Guiding Zero-shot Composed Image Retrieval with Prescriptive and Proscriptive Constraints,13,19,2025,0.2597268526240079,0.2111340372694533
246,Large Language Models Approach Expert Pedagogical Quality in Math Tutoring but Differ in Instructional and Linguistic Profiles,5,20,2025,0.2721686390214092,-0.08575468776697924
247,Towards Optimal Performance and Action Consistency Guarantees in Dec-POMDPs with Inconsistent Beliefs and Limited Communication,0,21,2025,-0.03950832291962671,-0.10708954266019778
248,Improving Matrix Exponential for Generative AI Flows: A Taylor-Based Approach Beyond Paterson--Stockmeyer,14,22,2025,-0.14728544577833363,-0.030854677214375258
249,Sark: Oblivious Integrity Without Global State,14,23,2025,-0.09706503559993974,-0.0275309056806228
250,Adversarial Training for Failure-Sensitive User Simulation in Mental Health Dialogue Optimization,3,24,2025,0.0159454710542695,-0.0027536702992665865
251,OccuFly: A 3D Vision Benchmark for Semantic Scene Completion from the Aerial Perspective,6,10,2025,0.005725672615873718,0.27458736598726113
252,A General Purpose Method for Robotic Interception of Non-Cooperative Dynamic Targets,4,10,2025,-0.18691097613179838,0.01108849398304255
253,Subgroup Discovery with the Cox Model,14,10,2025,-0.15432800067647065,-0.05705373426062992
254,TS-Arena Technical Report -- A Pre-registered Live Forecasting Platform,3,10,2025,-0.009308892542255313,0.00947339781432735
255,Generalization of RLVR Using Causal Reasoning as a Testbed,15,10,2025,0.2607403220002293,-0.1307438208274711
256,TokSuite: Measuring the Impact of Tokenizer Choice on Language Model Behavior,3,10,2025,0.1449622576911505,-0.0010310784819861944
257,Bridging Efficiency and Safety: Formal Verification of Neural Networks with Early Exits,10,10,2025,-0.1729309380732418,-0.131481813748807
258,Stabilizing Multimodal Autoencoders: A Theoretical and Empirical Analysis of Fusion Strategies,13,10,2025,0.01720687097743868,0.07427862291226289
259,Fixed-time control with prescribed performance for path following of underwater gliders,14,10,2025,-0.1364404492712503,0.011364022049130531
260,A Physics Informed Neural Network For Deriving MHD State Vectors From Global Active Regions Observations,2,10,2025,-0.1354408927084701,-0.01144391174543392
261,TrashDet: Iterative Neural Architecture Search for Efficient Waste Detection,9,10,2025,-0.18358660140818872,-0.013774575204712428
262,AgentMath: Empowering Mathematical Reasoning for Large Language Models via Tool-Augmented Agent,15,10,2025,0.3798402069068451,-0.13517800016713508
263,AI-Driven Green Cognitive Radio Networks for Sustainable 6G Communication,10,10,2025,-0.21870439451584922,-0.24552572762255948
264,VL4Gaze: Unleashing Vision-Language Models for Gaze Following,12,10,2025,0.3145661857408742,0.12598801074630026
265,Towards a Security Plane for 6G Ecosystems,10,10,2025,-0.11507278426226206,-0.03345713851183312
266,FEM-Bench: A Structured Scientific Reasoning Benchmark for Evaluating Code-Generating LLMs,15,10,2025,0.40953513940478103,-0.18932957177119816
267,Shifted Partial Derivative Polynomial Rank and Codimension,2,10,2025,-0.04084142526238101,-0.003942485804742886
268,SA-DiffuSeq: Addressing Computational and Scalability Challenges in Long-Document Generation with Sparse Attention,11,10,2025,0.021181893265526212,0.2573712525338405
269,From artificial to organic: Rethinking the roots of intelligence for digital health,18,10,2025,-0.025999178719723213,-0.2070400828719645
270,Learning-Enabled Elastic Network Topology for Distributed ISAC Service Provisioning,10,10,2025,-0.2693202558248341,-0.15495265057301114
271,SoK: Speedy Secure Finality,10,10,2025,-0.1004205553923559,-0.05927112816154105
272,From Pilots to Practices: A Scoping Review of GenAI-Enabled Personalization in Computer Science Education,18,10,2025,0.01712601619470288,-0.10415459158074579
273,Real-World Adversarial Attacks on RF-Based Drone Detectors,9,10,2025,-0.05933713210762775,0.10807698934809574
274,Anytime Metaheuristic Framework for Global Route Optimization in Expected-Time Mobile Search,14,10,2025,-0.10320707380042857,0.024524662457146337
275,Anota: Identifying Business Logic Vulnerabilities via Annotation-Based Sanitization,2,10,2025,0.04327346803996229,-0.03104259140291499
276,Process Analytics -- Data-driven Business Process Management,3,10,2025,-0.07656024581479458,-0.07900400223031372
277,SemanticGen: Video Generation in Semantic Space,16,10,2025,0.008935051003639546,0.36685961067714556
278,LongVideoAgent: Multi-Agent Reasoning with Long Videos,0,10,2025,0.17945221236330067,-0.13945355046347582
279,SpatialTree: How Spatial Abilities Branch Out in MLLMs,15,10,2025,0.1755624406318956,0.024701728068468886
280,Active Intelligence in Video Avatars via Closed-loop World Modeling,16,10,2025,0.13195734113630672,0.23761843792351717
281,Making Large Language Models Efficient Dense Retrievers,5,10,2025,0.3287976136160584,-0.03391215063026728
282,FedPOD: the deployable units of training for federated learning,3,10,2025,-0.22611672885308048,-0.12129749213584991
283,Saddle-to-Saddle Dynamics Explains A Simplicity Bias Across Neural Network Architectures,10,10,2025,-0.24959888433703956,-0.06927345814827796
284,Repurposing Video Diffusion Transformers for Robust Point Tracking,16,10,2025,0.005068732694881094,0.3333329757423821
285,Emergent temporal abstractions in autoregressive models enable hierarchical reinforcement learning,1,10,2025,-0.03970268900941519,-0.10881359230810755
286,MoE-DiffuSeq: Enhancing Long-Document Diffusion Models with Sparse Attention and Mixture of Experts,11,10,2025,0.05389141428796157,0.27727885600528257
287,On the near-tightness of $χ\leq 2r$: a general $σ$-ary construction and a binary case via LFSRs,14,11,2025,-0.06081164324421645,-0.00792434147645918
288,Cube Bench: A Benchmark for Spatial Visual Reasoning in MLLMs,15,12,2025,0.2919616359104077,0.059121019726935044
289,LightTact: A Visual-Tactile Fingertip Sensor for Deformation-Independent Contact Sensing,12,13,2025,0.1365769986334674,0.16668363908426756
290,Leveraging High-Fidelity Digital Models and Reinforcement Learning for Mission Engineering: A Case Study of Aerial Firefighting Under Perfect Information,1,14,2025,-0.10824495730408401,-0.23525907372850902
291,Certified Lower Bounds and Efficient Estimation of Minimum Accuracy in Quantum Kernel Methods,7,15,2025,-0.1743269087883334,-0.05364673268785209
292,Quantum Gates from Wolfram Model Multiway Rewriting Systems,7,16,2025,-0.14357743918257002,-0.14067201903716134
293,Automated stereotactic radiosurgery planning using a human-in-the-loop reasoning large language model agent,15,17,2025,0.3642865657767219,-0.28472370121805884
294,A human-centered approach to reframing job satisfaction in the BIM-enabled construction industry,14,18,2025,-0.024079686097600046,-0.10346431564476594
295,Making Sense of Private Advertising: A Principled Approach to a Complex Ecosystem,14,19,2025,-0.05149740729442616,-0.040920736964539
296,Relu and softplus neural nets as zero-sum turn-based games,10,20,2025,-0.32272714900353805,-0.13587915151848756
297,Can LLMs Predict Their Own Failures? Self-Awareness via Internal Circuits,17,21,2025,0.28000442127034547,-0.06523673509018317
298,Improving ML Training Data with Gold-Standard Quality Metrics,3,22,2025,-0.09870418818664436,0.06744624243325106
299,Performative Policy Gradient: Optimality in Performative Reinforcement Learning,1,23,2025,-0.18877636555921537,-0.1802769330813387
300,"Fail Fast, Win Big: Rethinking the Drafting Strategy in Speculative Decoding via Diffusion LLMs",11,24,2025,0.2381063889269761,0.04506227194528941
301,The Limitations and Power of NP-Oracle-Based Functional Synthesis Techniques,14,10,2025,-0.1710570311072748,-0.09955616429417381
302,Composing Mini Oscilloscope on Embedded Systems,14,10,2025,-0.14541163356781048,-0.09462181266049362
303,Distilling to Hybrid Attention Models via KL-Guided Layer Selection,2,10,2025,-0.03644174753322608,0.07157356128265947
304,LEAD: Minimizing Learner-Expert Asymmetry in End-to-End Driving,3,10,2025,-0.021854861938551035,-0.00468505403282716
305,Shallow Neural Networks Learn Low-Degree Spherical Polynomials with Learnable Channel Attention,10,10,2025,-0.2429680651603902,-0.04287078812137752
306,FlashVLM: Text-Guided Visual Token Selection for Large Multimodal Models,12,10,2025,0.1677980816344829,0.43625627544080614
307,Learning to Reason in 4D: Dynamic Spatial Understanding for Vision Language Models,6,10,2025,0.17703474617453008,0.21023679209107862
308,Multi-Grained Text-Guided Image Fusion for Multi-Exposure and Multi-Focus Scenarios,13,10,2025,0.11599601592271307,0.35883125805033417
309,Information-theoretic signatures of causality in Bayesian networks and hypergraphs,10,10,2025,-0.14862976113967008,-0.06839965582100911
310,LLM-Based Authoring of Agent-Based Narratives through Scene Descriptions,0,10,2025,0.1804755638145659,-0.2290460155241441
311,Advancing Multimodal Teacher Sentiment Analysis:The Large-Scale T-MED Dataset & The Effective AAM-TSA Model,13,10,2025,-0.004223141531592885,0.1171587041119523
312,AlignPose: Generalizable 6D Pose Estimation via Multi-view Feature-metric Alignment,2,10,2025,-0.0597760608534192,0.18229586532276534
313,ARBITER: AI-Driven Filtering for Role-Based Access Control,5,10,2025,0.047507226351631605,-0.16573133134616186
314,Over-the-Air Goal-Oriented Communications,10,10,2025,-0.2783365355845782,-0.09852686603780673
315,SirenPose: Dynamic Scene Reconstruction via Geometric Supervision,4,10,2025,-0.11448206412516061,0.20982049873329056
316,ScoreMatchingRiesz: Auto-DML with Infinitesimal Classification,14,10,2025,-0.22328269641303894,-0.03923121867550346
317,Benchmarking LLMs for Predictive Applications in the Intensive Care Units,17,10,2025,0.30499960324522707,-0.12470306040635654
318,"Expected Revenue, Risk, and Grid Impact of Bitcoin Mining: A Decision-Theoretic Perspective",14,10,2025,-0.04929366174648274,-0.015380194993109489
319,Explainable time-series forecasting with sampling-free SHAP for Transformers,2,10,2025,-0.1578451037217569,-0.028059978401426214
320,Recurrent Off-Policy Deep Reinforcement Learning Doesn't Have to be Slow,1,10,2025,-0.1549230884610494,-0.11609051153675888
321,Bridging Modalities and Transferring Knowledge: Enhanced Multimodal Understanding and Recognition,13,10,2025,0.13145438647794416,0.15568477734560415
322,Nebula: Enable City-Scale 3D Gaussian Splatting in Virtual Reality via Collaborative Rendering and Accelerated Stereo Rasterization,4,10,2025,-0.04542565720319043,0.26754972698812773
323,Step-DeepResearch Technical Report,0,10,2025,0.081394456764915,-0.08880680789662966
324,Multi-temporal Adaptive Red-Green-Blue and Long-Wave Infrared Fusion for You Only Look Once-Based Landmine Detection from Unmanned Aerial Systems,9,10,2025,-0.0880575116571337,0.009659715562622415
325,The Design of an Interactive Proof Mode for Dafny,14,10,2025,-0.07351819655230928,-0.028483496088726946
326,WOC: Dual-Path Weighted Object Consensus Made Efficient,2,10,2025,-0.1023872670519847,0.012860388157623736
327,"SweRank+: Multilingual, Multi-Turn Code Ranking for Software Issue Localization",17,10,2025,0.2185179330823309,-0.03025124506087029
328,Coherence in the brain unfolds across separable temporal regimes,5,10,2025,0.13930188644531025,-0.07706421674453257
329,UTDesign: A Unified Framework for Stylized Text Editing and Generation in Graphic Design Images,13,10,2025,0.06940648614199318,0.2695758875651031
330,Drift-Corrected Monocular VIO and Perception-Aware Planning for Autonomous Drone Racing,18,10,2025,-0.02345422051814524,-0.01655836475118082
331,Bohrium + SciMaster: Building the Infrastructure and Ecosystem for Agentic Science at Scale,18,10,2025,0.17771728437603188,-0.21692383592596326
332,Snapshot 3D image projection using a diffractive decoder,6,10,2025,-0.07004611162425614,0.42137231652358853
333,The Aligned Economic Index & The State Switching Model,14,10,2025,-0.08580244180201278,0.02789651118537416
334,Laser: Governing Long-Horizon Agentic Search via Structured Protocol and Context Register,15,10,2025,0.4039915451247982,-0.12086126681409921
335,When Natural Strategies Meet Fuzziness and Resource-Bounded Actions (Extended Version),0,10,2025,0.04963461248939658,-0.11994034527867929
336,Beyond Motion Pattern: An Empirical Study of Physical Forces for Human Motion Understanding,4,10,2025,0.04772044795566989,0.21779411713043897
337,Machine Learning to Predict Digital Frustration from Clickstream Data,3,11,2025,-0.09863968577736465,-0.09627439492857189
338,Dual-Encoder Transformer-Based Multimodal Learning for Ischemic Stroke Lesion Segmentation Using Diffusion MRI,11,12,2025,-0.07606776635102994,0.13174946362038997
339,High Dimensional Data Decomposition for Anomaly Detection of Textured Images,9,13,2025,-0.10171537111301343,0.13510233595614266
340,Skin Lesion Classification Using a Soft Voting Ensemble of Convolutional Neural Networks,9,14,2025,-0.1793216989727384,-0.025848314515442596
341,Evasion-Resilient Detection of DNS-over-HTTPS Data Exfiltration: A Practical Evaluation and Toolkit,9,15,2025,-0.09062993204578826,-0.008035381358829316
342,Simplifying Multi-Task Architectures Through Task-Specific Normalization,2,16,2025,-0.0027499404147039302,-0.016828269380815226
343,Chain-of-Anomaly Thoughts with Large Vision-Language Models,15,17,2025,0.39153255504091367,-0.05151707680316508
344,DETACH : Decomposed Spatio-Temporal Alignment for Exocentric Video and Ambient Sensors with Staged Learning,16,18,2025,-0.03015563246883597,0.2137022094698079
345,AUDRON: A Deep Learning Framework with Fused Acoustic Signatures for Drone Type Recognition,9,19,2025,-0.24373564220870925,-0.05929931019825042
346,ChatGPT: Excellent Paper! Accept It. Editor: Imposter Found! Review Rejected,5,20,2025,0.27940351592711676,-0.269166321533091
347,Sentiment-Aware Extractive and Abstractive Summarization for Unstructured Text Mining,2,21,2025,-0.002136929033040862,0.07737544338964136
348,BRIDGE: Budget-aware Reasoning via Intermediate Distillation with Guided Examples,15,22,2025,0.21323791849473273,-0.04526067510308748
349,iblock: Accurate and Scalable Bitcoin Simulations with OMNeT++,14,23,2025,-0.07164870323357977,0.026130263799358792
350,GeoTransolver: Learning Physics on Irregular Domains Using Multi-scale Geometry Aware Physics Attention Transformer,2,24,2025,-0.0653704617090218,0.08112797346009458
351,Symmaries: Automatic Inference of Formal Security Summaries for Java Programs,17,10,2025,-0.023684637251667567,-0.021389091443117455
352,Resilient Packet Forwarding: A Reinforcement Learning Approach to Routing in Gaussian Interconnected Networks with Clustered Faults,10,10,2025,-0.24685962723592988,-0.1835433354344386
353,Contingency Model-based Control (CMC) for Communicationless Cooperative Collision Avoidance in Robot Swarms,14,10,2025,-0.12148788430318355,-0.0410611651864719
354,Viterbi State Selection for Discrete Pinching Antenna Systems,14,10,2025,-0.17929560894287117,-0.04392134587250874
355,Generative Digital Twins: Vision-Language Simulation Models for Executable Industrial Systems,12,10,2025,0.2813603198786946,0.051079367034026664
356,Anisotropic Green Coordinates,14,10,2025,-0.1496264542594201,0.04891043280194198
357,Identifying Appropriately-Sized Services with Deep Reinforcement Learning,1,10,2025,-0.03066449592542059,-0.08866680848821501
358,A Covariance-Surrogate Framework for Movable-Antenna Enabled Anti-Jamming with Unknown Jammers,14,10,2025,-0.1425911634161662,-0.0837214833554729
359,SmartSplat: Feature-Smart Gaussians for Scalable Compression of Ultra-High-Resolution Images,2,10,2025,-0.05793343186247617,0.3266041161465495
360,Linking Faces and Voices Across Languages: Insights from the FAME 2026 Challenge,14,10,2025,-0.020195056677733,-0.016409120073697343
361,CLIP Based Region-Aware Feature Fusion for Automated BBPS Scoring in Colonoscopy Images,2,10,2025,-0.07179603301819044,0.17052678182093195
362,Cross-Population White Matter Atlas Creation for Concurrent Mapping of Brain Connections in Neonates and Adults with Diffusion MRI Tractography,11,10,2025,-0.06087703768922402,0.0926936208035909
363,EnvSSLAM-FFN: Lightweight Layer-Fused System for ESDD 2026 Challenge,9,10,2025,-0.09380289824500505,0.04943929006226391
364,Avoiding the Price of Adaptivity: Inference in Linear Contextual Bandits via Stability,14,10,2025,-0.16057516791731263,-0.05530561957764967
365,Clust-PSI-PFL: A Population Stability Index Approach for Clustered Non-IID Personalized Federated Learning,3,10,2025,-0.1948757686596616,-0.035119280281801064
366,CRAFT: Continuous Reasoning and Agentic Feedback Tuning for Multimodal Text-to-Image Generation,15,10,2025,0.32237557934476224,0.09979763855274848
367,FAR-AVIO: Fast and Robust Schur-Complement Based Acoustic-Visual-Inertial Fusion Odometry with Sensor Calibration,12,10,2025,-0.025456815151984936,0.15996056875027606
368,Multi-LLM Thematic Analysis with Dual Reliability Metrics: Combining Cohen's Kappa and Semantic Similarity for Qualitative Research Validation,5,10,2025,0.11647366263702082,-0.10800254751698148
369,Field-Space Attention for Structure-Preserving Earth System Transformers,2,10,2025,-0.11709918419304732,0.0874631963209746
370,Physics-guided Neural Network-based Shaft Power Prediction for Vessels,10,10,2025,-0.3042015319691393,-0.08931677522257139
