paper_id,title,topic,citations,year,cluster,arxiv_id
676,Anatomy-R1: Enhancing Anatomy Reasoning in Multimodal Large Language Models via Anatomical Similarity Curriculum and Group Diversity Augmentation,,25,2025,15,2512.19512v2
677,Toward Scalable and Valid Conditional Independence Testing with Spectral Representations,Topic 2,26,2025,2,2512.19510v1
678,Beyond Language Boundaries: Uncovering Programming Language Families for Code Language Models,,27,2025,17,2512.19509v1
679,DK-STN: A Domain Knowledge Embedded Spatio-Temporal Network Model for MJO Forecast,,28,2025,10,2512.19506v1
680,FusionNet: Physics-Aware Representation Learning for Multi-Spectral and Thermal Data via Trainable Signal-Processing Priors,Topic 3,29,2025,3,2512.19504v1
681,Fare Zone Assignment,,30,2025,14,2512.19493v1
682,Kolmogorov-Arnold Graph Neural Networks Applied to Inorganic Nanomaterials Dataset,,31,2025,8,2512.19494v1
683,Learning from sanctioned government suppliers: A machine learning and network science approach to detecting fraud and corruption in Mexico,,32,2025,10,2512.19491v1
684,Rethinking Coupled Tensor Analysis for Hyperspectral Super-Resolution: Recoverable Modeling Under Endmember Variability,Topic 2,33,2025,2,2512.19489v1
685,Lightweight Intrusion Detection in IoT via SHAP-Guided Feature Pruning and Knowledge-Distilled Kronecker Networks,,34,2025,9,2512.19488v1
686,Sequential Apportionment from Stationary Divisor Methods,,35,2025,14,2512.20686v1
687,Dynamic Stream Network for Combinatorial Explosion Problem in Deformable Medical Image Registration,Topic 2,36,2025,2,2512.19486v1
688,Structured Event Representation and Stock Return Predictability,Topic 2,37,2025,2,2512.19484v1
689,A Dataset and Preliminary Study of Using GPT-5 for Code-change Impact Analysis,,38,2025,17,2512.19481v1
690,Emotion-Director: Bridging Affective Shortcut in Emotion-Oriented Image Generation,,39,2025,11,2512.19479v1
691,A Large-Language-Model Framework for Automated Humanitarian Situation Reporting,,40,2025,5,2512.19475v1
692,"Multi-Layer Confidence Scoring for Detection of Out-of-Distribution Samples, Adversarial Attacks, and In-Distribution Misclassifications",Topic 2,41,2025,2,2512.19472v1
693,GLUE: Generative Latent Unification of Expertise-Informed Engineering Models,Topic 3,42,2025,3,2512.19469v1
694,Fully Asynchronous Unsourced Random Access over Fading Channels,,43,2025,9,2512.19468v1
695,Epistemological Fault Lines Between Human and Artificial Intelligence,,44,2025,18,2512.19466v1
696,Diffusion Models in Simulation-Based Inference: A Tutorial Review,,45,2025,11,2512.20685v1
697,An Agentic Framework for Autonomous Materials Computation,,46,2025,17,2512.19458v1
698,Learned Digital Codes for Over-the-Air Computation in Federated Edge Learning,,47,2025,10,2512.19777v1
699,Activations as Features: Probing LLMs for Generalizable Essay Scoring Representations,,48,2025,17,2512.19456v1
700,SiamGPT: Quality-First Fine-Tuning for Stable Thai Text Generation,Topic 3,49,2025,3,2512.19455v2
701,MaP-AVR: A Meta-Action Planner for Agents Leveraging Vision Language Models and Retrieval-Augmented Generation,Topic 0,10,2025,0,2512.19453v1
702,Sign Language Recognition using Parallel Bidirectional Reservoir Computing,Topic 2,10,2025,2,2512.19451v1
703,Sensitivity-Aware Mixed-Precision Quantization for ReRAM-based Computing-in-Memory,Topic 2,10,2025,2,2512.19445v1
704,D2Pruner: Debiased Importance and Structural Diversity for MLLM Token Pruning,Topic 2,10,2025,2,2512.19443v1
705,Real-Time Streamable Generative Speech Restoration with Flow Matching,,10,2025,11,2512.19442v1
706,Binary Kernel Logistic Regression: a sparsity-inducing formulation and a convergent decomposition training algorithm,Topic 3,10,2025,3,2512.19440v1
707,An Inverse Scattering Inspired Fourier Neural Operator for Time-Dependent PDE Learning,,10,2025,10,2512.19439v1
708,MT-Mark: Rethinking Image Watermarking via Mutual-Teacher Collaboration with Adaptive Feature Modulation,Topic 2,10,2025,2,2512.19438v1
709,dMLLM-TTS: Self-Verified and Efficient Test-Time Scaling for Diffusion Multi-Modal Large Language Models,,10,2025,11,2512.19433v1
710,"MobileWorld: Benchmarking Autonomous Mobile Agents in Agent-User Interactive, and MCP-Augmented Environments",Topic 0,10,2025,0,2512.19432v1
711,Attention Is Not What You Need,Topic 2,10,2025,2,2512.19428v1
712,A Computationally Efficient Framework for Overlapping Community Detection in Large Bipartite Graphs,,11,2025,9,2512.19426v1
713,CodeSimpleQA: Scaling Factuality in Code Large Language Models,,12,2025,17,2512.19424v1
714,Non-Contrast CT Esophageal Varices Grading through Clinical Prior-Enhanced Multi-Organ Analysis,,13,2025,14,2512.19415v1
715,From Retrieval to Reasoning: A Framework for Cyber Threat Intelligence NER with Explicit and Adaptive Instructions,,14,2025,13,2512.19414v1
716,Research Program: Theory of Learning in Dynamical Systems,,15,2025,14,2512.19410v1
717,Symplectic Reservoir Representation of Legendre Dynamics,Topic 2,16,2025,2,2512.19409v1
718,Mixed formulation and structure-preserving discretization of Cosserat rod dynamics in a port-Hamiltonian framework,,17,2025,14,2512.19408v1
719,Three Tiers and Thresholds: Incentives in Private Market Investing,Topic 0,18,2025,0,2512.19405v1
720,Real2Edit2Real: Generating Robotic Demonstrations via a 3D Control Interface,,19,2025,6,2512.19402v1
721,Undecidability of theories of semirings with fixed points,,20,2025,14,2512.19401v1
722,Kunnafonidilaw ka Cadeau: an ASR dataset of present-day Bambara,,21,2025,17,2512.19400v1
723,Brain-Grounded Axes for Reading and Steering LLM States,,22,2025,5,2512.19399v1
724,EchoTrail-GUI: Building Actionable Memory for GUI Agents via Critic-Guided Self-Exploration,Topic 0,23,2025,0,2512.19396v1
725,TwinAligner: Visual-Dynamic Alignment Empowers Physics-aware Real2Sim2Real for Robotic Manipulation,,24,2025,12,2512.19390v1
726,Fair Team Contracts,,25,2025,14,2512.19388v1
727,DSTED: Decoupling Temporal Stabilization and Discriminative Enhancement for Surgical Workflow Recognition,Topic 2,26,2025,2,2512.19387v1
728,Real-Time Machine Learning for Embedded Anomaly Detection,,27,2025,9,2512.19383v1
729,OmniMER: Indonesian Multimodal Emotion Recognition via Auxiliary-Enhanced LLM Adaptation,,28,2025,13,2512.19379v1
730,HATS: High-Accuracy Triple-Set Watermarking for Large Language Models,,29,2025,9,2512.19378v1
731,A Critical Assessment of Pattern Comparisons Between POD and Autoencoders in Intraventricular Flows,Topic 2,30,2025,2,2512.19376v1
732,DeepGESI: A Non-Intrusive Objective Evaluation Model for Predicting Speech Intelligibility in Hearing-Impaired Listeners,,31,2025,14,2512.19374v1
733,Cluster-Based Generalized Additive Models Informed by Random Fourier Features,Topic 2,32,2025,2,2512.19373v1
734,Sprecher Networks: A Parameter-Efficient Kolmogorov-Arnold Architecture,,33,2025,10,2512.19367v1
735,Learning General Policies with Policy Gradient Methods,Topic 1,34,2025,1,2512.19366v1
736,Efficient Spike-driven Transformer for High-performance Drone-View Geo-Localization,Topic 2,35,2025,2,2512.19365v1
737,From Points to Coalitions: Hierarchical Contrastive Shapley Values for Prioritizing Data Samples,Topic 3,36,2025,3,2512.19363v1
738,Interpretable Hybrid Deep Q-Learning Framework for IoT-Based Food Spoilage Prediction with Synthetic Data Generation and Hardware Validation,,37,2025,10,2512.19361v1
739,Generative vector search to improve pathology foundation models across multimodal vision-language tasks,,38,2025,13,2512.19360v1
740,First-Order Representation Languages for Goal-Conditioned RL,Topic 1,39,2025,1,2512.19355v1
741,ReasonCD: A Multimodal Reasoning Large Model for Implicit Change-of-Interest Semantic Mining,,40,2025,15,2512.19354v1
742,PENDULUM: A Benchmark for Assessing Sycophancy in Multimodal Large Language Models,,41,2025,13,2512.19350v1
743,VIGOR+: Iterative Confounder Generation and Validation via LLM-CEVAE Feedback Loop,,42,2025,5,2512.19349v1
744,OMP: One-step Meanflow Policy with Directional Alignment,Topic 1,43,2025,1,2512.19347v1
745,Faster Distributed Inference-Only Recommender Systems via Bounded Lag Synchronous Collectives,,44,2025,14,2512.19342v1
746,Enhancing PLS of Indoor IRS-VLC Systems for Colluding and Non-Colluding Eavesdroppers,,45,2025,14,2512.19339v1
747,GANeXt: A Fully ConvNeXt-Enhanced Generative Adversarial Network for MRI- and CBCT-to-CT Synthesis,Topic 3,46,2025,3,2512.19336v1
748,Orthogonal Approximate Message Passing with Optimal Spectral Initializations for Rectangular Spiked Matrix Models,,47,2025,14,2512.19334v1
749,A Logical View of GNN-Style Computation and the Role of Activation Functions,,48,2025,14,2512.19332v1
750,DeltaMIL: Gated Memory Integration for Efficient and Discriminative Whole Slide Image Analysis,Topic 2,49,2025,2,2512.19331v1
751,Stochastic assignment games for Mobility-as-a-Service markets,,10,2025,14,2512.19328v1
752,Extended OpenTT Games Dataset: A table tennis dataset for fine-grained shot type and point outcome,,10,2025,16,2512.19327v1
753,Simulations between Strongly Sublinear MPC and Node-Capacitated Clique,,10,2025,8,2512.19326v1
754,Alternative positional encoding functions for neural transformers,,10,2025,10,2512.19323v1
755,Learning-Assisted Multi-Operator Variable Neighborhood Search for Urban Cable Routing,,10,2025,14,2512.19321v1
756,MAGIC: Achieving Superior Model Merging via Magnitude Calibration,Topic 2,10,2025,2,2512.19320v1
757,SafeMed-R1: Adversarial Reinforcement Learning for Generalizable and Robust Medical Reasoning in Vision-Language Models,,10,2025,15,2512.19317v1
758,Neural Implicit Heart Coordinates: 3D cardiac shape reconstruction from sparse segmentations,,10,2025,6,2512.19316v2
759,Protecting Quantum Circuits Through Compiler-Resistant Obfuscation,,10,2025,7,2512.19314v1
760,Results on cubic bent and weakly regular bent $p$-ary functions leading to a class of cubic ternary non-weakly regular bent functions,,10,2025,14,2512.19313v1
761,MixFlow Training: Alleviating Exposure Bias with Slowed Interpolation Mixture,Topic 3,10,2025,3,2512.19311v1
762,Time-Vertex Machine Learning for Optimal Sensor Placement in Temporal Graph Signals: Applications in Structural Health Monitoring,,11,2025,8,2512.19309v1
763,On the construction of Cauchy MDS matrices over Galois rings via nilpotent elements and Frobenius maps,,12,2025,14,2512.19306v1
764,CienaLLM: Generative Climate-Impact Extraction from News Articles with Autoregressive LLMs,,13,2025,5,2512.19305v1
765,Binary Neural Network Implementation for Handwritten Digit Recognition on FPGA,,14,2025,10,2512.19304v1
766,Bridging Semantics and Geometry: A Decoupled LVLM-SAM Framework for Reasoning Segmentation in Remote Sensing,,15,2025,15,2512.19302v1
767,RMLer: Synthesizing Novel Objects across Diverse Categories via Reinforcement Mixing Learning,Topic 1,16,2025,1,2512.19300v1
768,Helios: A Foundational Language Model for Smart Energy Knowledge Reasoning and Application,,17,2025,17,2512.19299v1
769,Causal-Guided Detoxify Backdoor Attack of Open-Weight LoRA Models,Topic 3,18,2025,3,2512.19297v1
770,LOCO: A Low-Cost SNU-Self-Resilient Latch Using an Output-Split C-Element,,19,2025,14,2512.19292v1
771,Comparison and Evaluation of Different Simulation Environments for Rigid Body Systems,,20,2025,14,2512.19289v1
772,Vibe Reasoning: Eliciting Frontier AI Mathematical Capabilities -- A Case Study on IMO 2025 Problem 6,,21,2025,18,2512.19287v1
773,GShield: Mitigating Poisoning Attacks in Federated Learning,Topic 3,22,2025,3,2512.19286v1
774,Hand-Aware Egocentric Motion Reconstruction with Sequence-Level Context,Topic 4,23,2025,4,2512.19283v1
775,Digital Twin-Driven Zero-Shot Fault Diagnosis of Axial Piston Pumps Using Fluid-Borne Noise Signals,Topic 3,24,2025,3,2512.19280v1
776,Laplacian Network Optimization via Information Functions,,25,2025,10,2512.19279v1
777,Is Visual Realism Enough? Evaluating Gait Biometric Fidelity in Generative AI Human Animation,Topic 4,26,2025,4,2512.19275v1
778,Sonified Quantum Seizures. Sonification of time series in epileptic seizures and simulation of seizures via quantum modelling,,27,2025,7,2512.19272v1
779,"3SGen: Unified Subject, Style, and Structure-Driven Image Generation with Adaptive Task-specific Memory",Topic 2,28,2025,2,2512.19271v1
780,Are All Data Necessary? Efficient Data Pruning for Large-scale Autonomous Driving Dataset via Trajectory Entropy Maximization,Topic 3,29,2025,3,2512.19270v1
781,Translating Flow to Policy via Hindsight Online Imitation,Topic 1,30,2025,1,2512.19269v1
782,Machine Unlearning in the Era of Quantum Machine Learning: An Empirical Study,,31,2025,7,2512.19253v2
783,Small Language Models as Compiler Experts: Auto-Parallelization for Heterogeneous Systems,,32,2025,15,2512.19250v1
784,Auto-Prompting with Retrieval Guidance for Frame Detection in Logistics,,33,2025,15,2512.19247v1
785,From Black-Box Tuning to Guided Optimization via Hyperparameters Interaction Analysis,,34,2025,14,2512.19246v1
786,Vision-Aided Relative State Estimation for Approach and Landing on a Moving Platform with Inertial Measurements,Topic 4,35,2025,4,2512.19245v1
787,VisionDirector: Vision-Language Guided Closed-Loop Refinement for Generative Image Synthesis,,36,2025,12,2512.19243v1
788,ChemATP: A Training-Free Chemical Reasoning Framework for Large Language Models,,37,2025,15,2512.19240v1
789,Identifying Features Associated with Bias Against 93 Stigmatized Groups in Language Models and Guardrail Model Safety Mitigation,,38,2025,5,2512.19238v1
790,A Reverse Reachable Set Based Approach for Motif Oriented Profit maximization in Social Networks,,39,2025,14,2512.19237v1
791,Fast and Exact Least Absolute Deviations Line Fitting via Piecewise Affine Lower-Bounding,,40,2025,14,2512.20682v1
792,DeliveryBench: Can Agents Earn Profit in Real World?,Topic 0,41,2025,0,2512.19234v1
793,Regression generation adversarial network based on dual data evaluation strategy for industrial application,Topic 3,42,2025,3,2512.19232v1
794,Generation of Programmatic Rules for Document Forgery Detection Using Large Language Models,,43,2025,17,2512.19228v1
795,Selective Phase-Aware Training of nnU-Net for Robust Breast Cancer Segmentation in Multi-Center DCE-MRI,Topic 3,44,2025,3,2512.19225v1
796,Phase-space entropy at acquisition reflects downstream learnability,Topic 3,45,2025,3,2512.19223v1
797,From Pixels to Predicates Structuring urban perception with scene graphs,,46,2025,8,2512.19221v1
798,Towards Minimal Fine-Tuning of VLMs,,47,2025,13,2512.19219v1
799,Semantically-Equivalent Transformations-Based Backdoor Attacks against Neural Code Models: Characterization and Mitigation,,48,2025,17,2512.19215v1
800,HippMetric: A skeletal-representation-based framework for cross-sectional and longitudinal hippocampal substructural morphometry,Topic 2,49,2025,2,2512.19214v1
801,InvCoSS: Inversion-driven Continual Self-supervised Learning in Medical Multi-modal Image Pre-training,Topic 3,10,2025,3,2512.19213v1
802,"Observer, Not Player: Simulating Theory of Mind in LLMs through Game Observation",,10,2025,15,2512.19210v1
803,MixKVQ: Query-Aware Mixed-Precision KV Cache Quantization for Long-Context Reasoning,,10,2025,15,2512.19206v1
804,Evaluating MCC for Low-Frequency Cyberattack Detection in Imbalanced Intrusion Detection Data,,10,2025,9,2512.19203v1
805,On the Koopman-Based Generalization Bounds for Multi-Task Deep Learning,,10,2025,10,2512.19199v1
806,Self-Consistent Probability Flow for High-Dimensional Fokker-Planck Equations,,10,2025,11,2512.19196v1
807,"A K-Means, Ward and DBSCAN repeatability study",,10,2025,14,2512.19772v1
808,Causal Heterogeneous Graph Learning Method for Chronic Obstructive Pulmonary Disease Prediction,,10,2025,8,2512.19194v1
809,PEDESTRIAN: An Egocentric Vision Dataset for Obstacle Detection on Pavements,,10,2025,9,2512.19190v1
810,Configuration Work: Four Consequences of LLMs-in-use,,10,2025,17,2512.19189v1
811,Operator-Based Generalization Bound for Deep Learning: Insights on Multi-Task Learning,,10,2025,10,2512.19184v1
812,Practical Quantum-Classical Feature Fusion for complex data Classification,,11,2025,7,2512.19180v1
813,L4: Low-Latency and Load-Balanced LLM Serving via Length-Aware Scheduling,,12,2025,5,2512.19179v1
814,Vision-Language-Policy Model for Dynamic Robot Task Planning,,13,2025,12,2512.19178v1
815,Semantic Communication for Rate-Limited Closed-Loop Distributed Communication-Sensing-Control Systems,,14,2025,10,2512.19177v1
816,CycleChart: A Unified Consistency-Based Learning Framework for Bidirectional Chart Understanding and Generation,Topic 3,15,2025,3,2512.19173v1
817,Finite-sample guarantees for data-driven forward-backward operator methods,Topic 3,16,2025,3,2512.19172v1
818,JEPA-Reasoner: Decoupling Latent Reasoning from Token Generation,,17,2025,15,2512.19171v1
819,Towards a collaborative digital platform for railway infrastructure projects,,18,2025,14,2512.19169v1
820,From Speech to Subtitles: Evaluating ASR Models in Subtitling Italian Television Programs,Topic 3,19,2025,3,2512.19161v1
821,OmniMoGen: Unifying Human Motion Generation via Learning from Interleaved Text-Motion Instructions,Topic 4,20,2025,4,2512.19159v1
822,Classical billiards can compute,Topic 4,21,2025,4,2512.19156v1
823,"Can We Test Consciousness Theories on AI? Ablations, Markers, and Robustness",Topic 0,22,2025,0,2512.19155v1
824,Beyond Sliding Windows: Learning to Manage Memory in Non-Markovian Environments,Topic 0,23,2025,0,2512.19154v1
825,University Rents Enabling Corporate Innovation: Mapping Academic Researcher Coding and Discursive Labour in the R Language Ecosystem,,24,2025,14,2512.19153v1
826,AMap: Distilling Future Priors for Ahead-Aware Online HD Map Construction,Topic 2,25,2025,2,2512.19150v1
827,A Flexible Field-Based Policy Learning Framework for Diverse Robotic Systems and Sensors,Topic 1,26,2025,1,2512.19148v1
828,RP-CATE: Recurrent Perceptron-based Channel Attention Transformer Encoder for Industrial Hybrid Modeling,Topic 2,27,2025,2,2512.19147v1
829,A Convex Loss Function for Set Prediction with Optimal Trade-offs Between Size and Conditional Coverage,,28,2025,14,2512.19142v1
830,Understanding Chain-of-Thought in Large Language Models via Topological Data Analysis,,29,2025,15,2512.19135v1
831,QuCo-RAG: Quantifying Uncertainty from the Pre-training Corpus for Dynamic Retrieval-Augmented Generation,,30,2025,17,2512.19134v1
832,WorldRFT: Latent World Model Planning with Reinforcement Fine-Tuning for Autonomous Driving,Topic 1,31,2025,1,2512.19133v1
833,Evidential Trust-Aware Model Personalization in Decentralized Federated Learning for Wearable IoT,Topic 3,32,2025,3,2512.19131v1
834,D$^{2}$Stream: Decoupled Dual-Stream Temporal-Speaker Interaction for Audio-Visual Speaker Detection,,33,2025,12,2512.19130v1
835,AWPO: Enhancing Tool-Use of Large Language Models through Explicit Integration of Reasoning Rewards,,34,2025,15,2512.19126v2
836,SAP: Syntactic Attention Pruning for Transformer-based Language Models,Topic 2,35,2025,2,2512.19125v1
837,ShadowBlock: Efficient Dynamic Anonymous Blocklisting and Its Cross-chain Application,,36,2025,14,2512.19124v1
838,A Composable Channel-Adaptive Architecture for Seizure Classification,Topic 2,37,2025,2,2512.19123v1
839,BanglaForge: LLM Collaboration with Self-Refinement for Bangla Code Generation,,38,2025,17,2512.19122v1
840,Stop saying LLM: Large Discourse Models (LDM) and Artificial Discursive Agent (ADA)?,,39,2025,5,2512.19117v1
841,"Generative Giants, Retrieval Weaklings: Why do Multimodal Large Language Models Fail at Multimodal Retrieval?",,40,2025,13,2512.19115v1
842,HyperLoad: A Cross-Modality Enhanced Large Language Model-Based Framework for Green Data Center Cooling Load Prediction,Topic 3,41,2025,3,2512.19114v1
843,A Unified Framework and Comparative Study of Decentralized Finance Derivatives Protocols,,42,2025,14,2512.19113v1
844,Trifocal Tensor and Relative Pose Estimation with Known Vertical Direction,,43,2025,14,2512.19110v1
845,GaussianImage++: Boosted Image Representation and Compression with 2D Gaussian Splatting,Topic 2,44,2025,2,2512.19108v1
846,FC-MIR: A Mobile Screen Awareness Framework for Intent-Aware Recommendation based on Frame-Compressed Multimodal Trajectory Reasoning,Topic 0,45,2025,0,2512.19107v1
847,Explicit and Non-asymptotic Query Complexities of Rank-Based Zeroth-order Algorithm on Stochastic Smooth Functions,,46,2025,14,2512.19104v1
848,Timely Parameter Updating in Over-the-Air Federated Learning,,47,2025,10,2512.19103v1
849,Dual Model Deep Learning for Alzheimer Prognostication,,48,2025,10,2512.19099v1
850,DIVER-1 : Deep Integration of Vast Electrophysiological Recordings at Scale,Topic 3,49,2025,3,2512.19097v1
851,Conditioning Accept-Desirability models in the context of AGM-like belief change,Topic 2,10,2025,2,2512.19096v1
852,Mamba-Based Modality Disentanglement Network for Multi-Contrast MRI Reconstruction,Topic 2,10,2025,2,2512.19095v1
853,Low-Latency and Low-Complexity MLSE for Short-Reach Optical Interconnects,,10,2025,14,2512.19094v1
854,Tool-Augmented Hybrid Ensemble Reasoning with Distillation for Bilingual Mathematical Problem Solving,,10,2025,15,2512.19093v1
855,A Large Language Model Based Method for Complex Logical Reasoning over Knowledge Graphs,,10,2025,15,2512.19092v1
856,"Auditing Significance, Metric Choice, and Demographic Fairness in Medical AI Challenges",,10,2025,18,2512.19091v1
857,JoyVoice: Long-Context Conditioning for Anthropomorphic Multi-Speaker Conversational Synthesis,,10,2025,11,2512.19090v1
858,Retrieving Objects from 3D Scenes with Box-Guided Open-Vocabulary Instance Segmentation,,10,2025,6,2512.19088v1
859,"$γ(3,4)$ `Attention' in Cognitive Agents: Ontology-Free Knowledge Representations With Promise Theoretic Semantics",,10,2025,8,2512.19084v1
860,CoDrone: Autonomous Drone Navigation Assisted by Edge and Cloud Foundation Models,,10,2025,10,2512.19083v2
861,BEVCooper: Accurate and Communication-Efficient Bird's-Eye-View Perception in Vehicular Networks,Topic 2,10,2025,2,2512.19082v1
862,Population-Evolve: a Parallel Sampling and Evolutionary Method for LLM Math Reasoning,,11,2025,15,2512.19081v1
863,On Factoring and Power Divisor Problems via Rank-3 Lattices and the Second Vector,,12,2025,14,2512.19076v1
864,Optimal 3D Directional WPT Charging via UAV for 3D Wireless Rechargeable Sensor Networks,,13,2025,6,2512.19075v1
865,Watch Closely: Mitigating Object Hallucinations in Large Vision-Language Models with Disentangled Decoding,,14,2025,12,2512.19070v1
866,Can abstract concepts from LLM improve SLM performance?,,15,2025,5,2512.19069v1
867,On Cost-Aware Sequential Hypothesis Testing with Random Costs and Action Cancellation,,16,2025,14,2512.19067v1
868,Fraud Detection Through Large-Scale Graph Clustering with Heterogeneous Link Transformation,,17,2025,8,2512.19061v1
869,On the complexity of computing Strahler numbers,,18,2025,14,2512.19060v1
870,6DAttack: Backdoor Attacks in the 6DoF Pose Estimation,,19,2025,6,2512.19058v1
871,Efficient Personalization of Generative Models via Optimal Experimental Design,,20,2025,14,2512.19057v1
872,WaTeRFlow: Watermark Temporal Robustness via Flow Consistency,,21,2025,16,2512.19048v1
873,Decoupled Generative Modeling for Human-Object Interaction Synthesis,Topic 4,22,2025,4,2512.19049v1
874,Advancing Accessibility: Augmented Reality Solutions for the Blind and Disabled in Bangladesh,Topic 2,23,2025,2,2512.19047v1
875,EGM: Efficiently Learning General Motion Tracking Policy for High Dynamic Humanoid Whole-Body Control,Topic 4,24,2025,4,2512.19043v1
876,Time-series Forecast for Indoor Zone Air Temperature with Long Horizons: A Case Study with Sensor-based Data from a Smart Building,,25,2025,14,2512.19038v1
877,Elevating Intrusion Detection and Security Fortification in Intelligent Networks through Cutting-Edge Machine Learning Paradigms,,26,2025,9,2512.19037v1
878,Distinguishing Visually Similar Actions: Prompt-Guided Semantic Prototype Modulation for Few-Shot Action Recognition,,27,2025,12,2512.19036v1
879,Automatic Neuronal Activity Segmentation in Fast Four Dimensional Spatio-Temporal Fluorescence Imaging using Bayesian Approach,,28,2025,9,2512.19032v1
880,A Surrogate-Augmented Symbolic CFD-Driven Training Framework for Accelerating Multi-objective Physical Model Development,Topic 3,29,2025,3,2512.19031v1
881,A Declarative Language for Building And Orchestrating LLM-Powered Agent Workflows,Topic 0,30,2025,0,2512.19769v1
882,Recontextualization Mitigates Specification Gaming without Modifying the Specification,Topic 3,31,2025,3,2512.19027v1
883,Finer-Personalization Rank: Fine-Grained Retrieval Examines Identity Preservation for Personalized Generation,,32,2025,13,2512.19026v1
884,The Erasure Illusion: Stress-Testing the Generalization of LLM Forgetting Evaluation,,33,2025,5,2512.19025v2
885,IndoorUAV: Benchmarking Vision-Language UAV Navigation in Continuous Indoor Environments,,34,2025,12,2512.19024v1
886,Steering Vision-Language Pre-trained Models for Incremental Face Presentation Attack Detection,,35,2025,9,2512.19022v2
887,"VLNVerse: A Benchmark for Vision-Language Navigation with Versatile, Embodied, Realistic Simulation and Evaluation",Topic 0,36,2025,0,2512.19021v1
888,CETCAM: Camera-Controllable Video Generation via Consistent and Extensible Tokenization,,37,2025,16,2512.19020v1
889,Optimizer Dynamics at the Edge of Stability with Differential Privacy,,38,2025,10,2512.19019v1
890,PEAK: A Performance Engineering AI-Assistant for GPU Kernels Powered by Natural Language Transformations,,39,2025,17,2512.19018v1
891,DREAM: Dynamic Red-teaming across Environments for AI Models,Topic 0,40,2025,0,2512.19016v1
892,DramaBench: A Six-Dimensional Evaluation Framework for Drama Script Continuation,,41,2025,5,2512.19012v2
893,Efficient Jailbreak Mitigation Using Semantic Linear Classification in a Multi-Staged Pipeline,,42,2025,5,2512.19011v1
894,PalpAid: Multimodal Pneumatic Tactile Sensor for Tissue Palpation,,43,2025,13,2512.19010v1
